vendor_code,vendor_name,asin,item_name_raw,item_name_clean,brand,category,sub_category,pack_size,pack_unit,notes
WJTPX,WJTowell,B01L1DRDKO,"American Garden Microwave Extra Butter Popcorn, Gluten-Free, 273g (3 Bags of 91g)",American Garden Microwave Extra B,,,,,,
WJTPX,WJTowell,B005UGW5R0,"American Garden Real Mayonnaise Original, Gluten-Free, Dairy-Free, 237ml",American Garden Real Mayonnaise O,,,,,,
WJTPX,WJTowell,B00NRML2XM,Dilmah Tag Tea bags 100/2.0G/12 English Breakfast,Dilmah Tag Tea bags 100/2.0G/12 E,,,,,,
WJTPX,WJTowell,B0014CYR98,"Splenda No Calorie Sweetener Packets 50 Ea, 50 Gm",Splenda No Calorie Sweetener Pack,,,,,,
WJTPX,WJTowell,B005FBKVZ8,DILMAH TBAG CEYLON GOLD 100/2.0g/12,DILMAH TBAG CEYLON GOLD 100/2.0g/,,,,,,
WJTPX,WJTowell,B091VSDXFF,"American Garden Real Mayonnaise Light, Gluten-Free, Dairy-Free, 400ml",American Garden Real Mayonnaise L,,,,,,
WJTPX,WJTowell,B083VKYVK5,"Al Rifai Peanut Krikri, 250 g","Al Rifai Peanut Krikri, 250 g",,,,,,
WJTPX,WJTowell,B08ZQF4KQJ,"Afia Extra Virgin Olive Oil Twin Pack, 2 X 500 Ml",Afia Extra Virgin Olive Oil Twin ,,,,,,
WJTPX,WJTowell,B084PTC895,"Diamond 100% pure and natural honey, 350 gm",Diamond 100% pure and natural hon,,,,,,
WJTPX,WJTowell,B088FCK2WJ,CHING'S GARLIC PASTE 300g,CHING'S GARLIC PASTE 300g,,,,,,
WJTPX,WJTowell,B00L28CLEW,"American Garden Mayonnaise Egg Free, Gluten-Free, Vegetarian, 460g",American Garden Mayonnaise Egg Fr,,,,,,
WJTPX,WJTowell,B07P76HBPW,"American Garden Classic Popcorn, Popcorn Kernels, Gluten-Free, 425g","American Garden Classic Popcorn, ",,,,,,
WJTPX,WJTowell,B0BF64NX4G,Diamond Sidr Honey Spoon BOX (7gx10),Diamond Sidr Honey Spoon BOX (7gx,,,,,,
WJTPX,WJTowell,B083VKBHX2,"Diamond Honey Glass Jar, 750 G","Diamond Honey Glass Jar, 750 G",,,,,,
WJTPX,WJTowell,B076QXVN8H,Afia Pure Corn Oil 750ml,Afia Pure Corn Oil 750ml,,,,,,
WJTPX,WJTowell,B072RK9TG9,Lotte Peppero Almond 32g,Lotte Peppero Almond 32g,,,,,,
WJTPX,WJTowell,B0949CFRSP,"Afia Corn Oil Twin Pack, 2 X 1.5 Litre - Pack Of 1","Afia Corn Oil Twin Pack, 2 X 1.5 ",,,,,,
WJTPX,WJTowell,B083VKND7S,"Tata Tea Premium Desh Ki Chai. Unique Blend Crafted For Chai Lovers, Black Tea, 200g Jar",Tata Tea Premium Desh Ki Chai. Un,,,,,,
WJTPX,WJTowell,B08CHW751L,CHINGS CHILLI SAUCE 680g,CHINGS CHILLI SAUCE 680g,,,,,,
WJTPX,WJTowell,B0DT62QDW5,TATA SOULFUL CORNFLAKES ORIGINAL 375gm,TATA SOULFUL CORNFLAKES ORIGINAL ,,,,,,
WJTPX,WJTowell,B07P83LFGN,Afia Sunflower Oil 750ml,Afia Sunflower Oil 750ml,,,,,,
WJTPX,WJTowell,B01M4LJ19V,Splenda Sugar Alternative Tablets - 100,Splenda Sugar Alternative Tablets,,,,,,
WJTPX,WJTowell,B083VKNDCY,"Sultan Coconut Milk Powder, 150 g","Sultan Coconut Milk Powder, 150 g",,,,,,
WJTPX,WJTowell,B083VKCGWQ,"American Garden Apple Pie Topping and Filling, 567 g, large",American Garden Apple Pie Topping,,,,,,
WJTPX,WJTowell,B0CZLC4GSB,Ching's Secret SCHEZWAN KETCHUP 485g,Ching's Secret SCHEZWAN KETCHUP 4,,,,,,
WJTPX,WJTowell,B07HNSPY84,Dilmah Tag Tea bags 100/1.5G/12 Pure Green,Dilmah Tag Tea bags 100/1.5G/12 P,,,,,,
WJTPX,WJTowell,B0CYT6SRXZ,Tata Coffee Grand Premium Instant Coffee | 100% Coffee Blend | With Flavour Locked Decoction Crystals |95g Jar,Tata Coffee Grand Premium Instant,,,,,,
WJTPX,WJTowell,B07NF98DQL,AL RIFAI MIXED NUTS 200g,AL RIFAI MIXED NUTS 200g,,,,,,
WJTPX,WJTowell,B083VKQWR6,ALRIFAI SALTED CASHEW TIN 110g,ALRIFAI SALTED CASHEW TIN 110g,,,,,,
WJTPX,WJTowell,B0FTFCM1XN,Tetley Green Tea Lemon and Honey 50 bags,Tetley Green Tea Lemon and Honey ,,,,,,
WJTPX,WJTowell,B0B4P6HYVX,Kanan Devan Tea Dust Jar 200g,Kanan Devan Tea Dust Jar 200g,,,,,,
WJTPX,WJTowell,B0D8J4DGVC,Afia Light Meat Tuna Chunk in Sunflower Oil 160 g,Afia Light Meat Tuna Chunk in Sun,,,,,,
WJTPX,WJTowell,B083VKRTVV,Kanan Devan Strong Black Tea 400g,Kanan Devan Strong Black Tea 400g,,,,,,
WJTPX,WJTowell,B0757317DM,"Ching's Secret Schezwan Noodles, 60 gm","Ching's Secret Schezwan Noodles, ",,,,,,
WJTPX,WJTowell,B000I0VTMA,"American Garden Real Mayonnaise Garlic, Gluten-Free, Dairy-Free, 473ml",American Garden Real Mayonnaise G,,,,,,
WJTPX,WJTowell,B083VK2HW1,"Sultan Coconut Milk Powder, 300 g","Sultan Coconut Milk Powder, 300 g",,,,,,
WJTPX,WJTowell,B0847W462N,"Ching's Secret Chowmein Haka Noodle Masala, 5 x 20 gm",Ching's Secret Chowmein Haka Nood,,,,,,
WJTPX,WJTowell,B083VL3P6Z,"Diamond Honey Squeeze, 125 G","Diamond Honey Squeeze, 125 G",,,,,,
WJTPX,WJTowell,B07P68FGXQ,American Garden Chicken Vienna Sausage 142g,American Garden Chicken Vienna Sa,,,,,,
WJTPX,WJTowell,B00R2UOFWU,DILMAH LEAFBAG WHITE TEA 10/2.0g/06,DILMAH LEAFBAG WHITE TEA 10/2.0g/,,,,,,
WJTPX,WJTowell,B07P5J63J9,"Foster Clark's Jelly Mango, 85 g","Foster Clark's Jelly Mango, 85 g",,,,,,
WJTPX,WJTowell,B07NF5BLTB,Al Rifai Oriental Crackers - 250 gm,Al Rifai Oriental Crackers - 250 ,,,,,,
WJTPX,WJTowell,B0FLDF6S1B,"Diamond Organic Raw Forest Honey ñ 350g ñ Pure, Unfiltered & Natural Sweetener",Diamond Organic Raw Forest Honey ,,,,,,
WJTPX,WJTowell,B083VKCGYM,"foster clark's Orange Cake Mix, 500 g","foster clark's Orange Cake Mix, 5",,,,,,
WJTPX,WJTowell,B08C18B3FH,Afia Pure Sunflower Oil 2.9Litre,Afia Pure Sunflower Oil 2.9Litre,,,,,,
WJTPX,WJTowell,B00NRML2UK,Dilmah Tag Tea bags 100/2.0G/12 Earl Grey,Dilmah Tag Tea bags 100/2.0G/12 E,,,,,,
WJTPX,WJTowell,B06XPFKCD1,Foster Clark's Food Colour Green Vert 28ml,Foster Clark's Food Colour Green ,,,,,,
WJTPX,WJTowell,B083VKKC9F,"foster clark's Almond Culinary Essence, 28 ml",foster clark's Almond Culinary Es,,,,,,
WJTPX,WJTowell,B00L2ZL28G,American Garden Blueberry Pie Filling - 21 Oz.,American Garden Blueberry Pie Fil,,,,,,
WJTPX,WJTowell,B0FLJG3X4C,Diamond Premium Saffron Super Negin Threads 1g Elegant Ring Box Packaging,Diamond Premium Saffron Super Neg,,,,,,
WJTPX,WJTowell,B019ZQGTFE,CHINGS SINGAPORE CURRY NOODLES 240g,CHINGS SINGAPORE CURRY NOODLES 24,,,,,,
WJTPX,WJTowell,B08C1DSWF3,Afia Pure Corn Oil 2.9Litre,Afia Pure Corn Oil 2.9Litre,,,,,,
WJTPX,WJTowell,B07PCMG31N,American Garden Americana Garden Sweet Corn Whole Kernel 425g,American Garden Americana Garden ,,,,,,
WJTPX,WJTowell,B01MUF8ED9,"SPLENDA Stevia Zero Calorie Sweetener, Plant Based Sugar Substitute Granulated Powder, Single Serve Packets, 80 Count",SPLENDA Stevia Zero Calorie Sweet,,,,,,
WJTPX,WJTowell,B0BF66Z4RT,DIAMOND ??????? Coconut Milk 400ml -Tin,DIAMOND ??????? Coconut Milk 400m,,,,,,
WJTPX,WJTowell,B01I2CF0NY,"Al Rifai egyptian seeds, 180 g","Al Rifai egyptian seeds, 180 g",,,,,,
WJTPX,WJTowell,B07NF7T22C,AL RIFAI COCKTAIL MIX NUTS 200g,AL RIFAI COCKTAIL MIX NUTS 200g,,,,,,
WJTPX,WJTowell,B083VKRRWG,Kanan Devan Tea Dust 200g,Kanan Devan Tea Dust 200g,,,,,,
WJTPX,WJTowell,B07576C6TW,CHINGS MANCHURIAN NOODLES 240g,CHINGS MANCHURIAN NOODLES 240g,,,,,,
WJTPX,WJTowell,B077ZCB3T7,"Tetley Original Black Tea,160 Round Tea Bags","Tetley Original Black Tea,160 Rou",,,,,,
GUXA4,Henkal Beauty,B07P8ZBNTX,Syoss Hair Spray Mega Strong Hold 400ml,Syoss Hair Spray Mega Strong Hold,,,,,,
GUXA4,Henkal Beauty,B07PC6J4YW,Syoss Keratin Hairspray 400Ml,Syoss Keratin Hairspray 400Ml,,,,,,
GUXA4,Henkal Beauty,B07PB4J8MG,"Syoss Strong Hold Hairspray, 400 ml","Syoss Strong Hold Hairspray, 400 ",,,,,,
GUXA4,Henkal Beauty,B07P6QJ4ZS,"Syoss Shine and Hold Hairspray, 400 ml","Syoss Shine and Hold Hairspray, 4",,,,,,
GUXA4,Henkal Beauty,B0848Q6D17,Got2B Schwarzkopf Water Resistant Spiking Glue Glued 150Ml,Got2B Schwarzkopf Water Resistant,,,,,,
GUXA4,Henkal Beauty,B0BN3DHYZQ,"Fa Shower Gel Vanilla Honey 250ml, Pack of 2",Fa Shower Gel Vanilla Honey 250ml,,,,,,
GUXA4,Henkal Beauty,B0BN3CTB7C,"Fa Shower Gel Kids Pirate 250ml, Pack of 2","Fa Shower Gel Kids Pirate 250ml, ",,,,,,
GUXA4,Henkal Beauty,B07NY2VF7T,Syoss Max Hold Power Gel - 250 ml,Syoss Max Hold Power Gel - 250 ml,,,,,,
GUXA4,Henkal Beauty,B00RVQHYM8,Schwarzkopf Taft Power Wax Hair Styler 75 Ml,Schwarzkopf Taft Power Wax Hair S,,,,,,
GUXA4,Henkal Beauty,B0CR4DSXH3,"Schwarzkopf Gliss Night Elixir Overnight Repair, 100ml",Schwarzkopf Gliss Night Elixir Ov,,,,,,
GUXA4,Henkal Beauty,B0BN3CYVMY,"Fa Shower Gel Kids Mermaid 250ml, Pack of 2, 1.0 count, 1","Fa Shower Gel Kids Mermaid 250ml,",,,,,,
GUXA4,Henkal Beauty,B0FHWFWM73,Schwarzkopf Creme Supreme Full Kit Permanent Hair Coloration 7-0 Natural Dark Blonde,Schwarzkopf Creme Supreme Full Ki,,,,,,
GUXA4,Henkal Beauty,B00CLSIBUU,"Schwarzkopf Gliss Ultimate Repair - Express Repair Conditioner, 200ml",Schwarzkopf Gliss Ultimate Repair,,,,,,
GUXA4,Henkal Beauty,B0B4NS6M82,"FA Deodorant Spray Aqua 150ml, Pack of 2","FA Deodorant Spray Aqua 150ml, Pa",,,,,,
GUXA4,Henkal Beauty,B0FHWD35QH,Schwarzkopf Creme Supreme Full Kit Permanent Hair Coloration 5-60 Chocolate Brown,Schwarzkopf Creme Supreme Full Ki,,,,,,
GUXA4,Henkal Beauty,B0FHWDY315,Schwarzkopf Creme Supreme Full Kit Permanent Hair Coloration 6-0 Natural Light Brown,Schwarzkopf Creme Supreme Full Ki,,,,,,
GUXA4,Henkal Beauty,B01CEGOYWW,"Syoss Keratin Shampoo + Conditioner, 500 ML",Syoss Keratin Shampoo + Condition,,,,,,
GUXA4,Henkal Beauty,B00UJKRVR6,"Schwarzkopf Palette Intensive Color Cream, 3-0 Dark Brown",Schwarzkopf Palette Intensive Col,,,,,,
GUXA4,Henkal Beauty,B0777GFTDQ,Taft Schwarzkopf Taft Hair Lacquer Ultimate 250 ml Hold 5+,Taft Schwarzkopf Taft Hair Lacque,,,,,,
GUXA4,Henkal Beauty,B0DG5MQR3G,"Schwarzkopf Gliss Ultimate Repair - Strength Shampoo, 400ml",Schwarzkopf Gliss Ultimate Repair,,,,,,
GUXA4,Henkal Beauty,B07P8ZBT7N,Syoss Ceramide Complex Hairspray 400Ml,Syoss Ceramide Complex Hairspray ,,,,,,
GUXA4,Henkal Beauty,B00QCE46KI,"Syoss Shampoo Repair Therapy, 500 Ml","Syoss Shampoo Repair Therapy, 500",,,,,,
GUXA4,Henkal Beauty,B01GTS0EJS,"Taft Lacquer Black Hair Spray, 250 ml","Taft Lacquer Black Hair Spray, 25",,,,,,
GUXA4,Henkal Beauty,B0B4NRMBSW,"FA Deodorant Spray Pink Passion 150ml, Pack of 2",FA Deodorant Spray Pink Passion 1,,,,,,
GUXA4,Henkal Beauty,B0DWG1DGWY,"Schwarzkopf Gliss 4-IN-1 Repair Bond-Building Hair Mask, 400ml",Schwarzkopf Gliss 4-IN-1 Repair B,,,,,,
GUXA4,Henkal Beauty,B0FHWG2QW2,Schwarzkopf Creme Supreme Full Kit Permanent Hair Coloration 6-16 Cool Ash Light Brown,Schwarzkopf Creme Supreme Full Ki,,,,,,
GUXA4,Henkal Beauty,B00UAGOQOA,Schwarzkopf Palette Intensive Color Creme 1-0 Black,Schwarzkopf Palette Intensive Col,,,,,,
GUXA4,Henkal Beauty,B07JNN2BVH,Palette Schwarzkopf Palette Intensive Color Creme 6-0 Dark Blonde,Palette Schwarzkopf Palette Inten,,,,,,
GUXA4,Henkal Beauty,B07LG66LG5,Palette Schwarzkopf Intensive Color Creme 7-1 Middle Ash Blonde,Palette Schwarzkopf Intensive Col,,,,,,
GUXA4,Henkal Beauty,B0DWG1K6KY,"Schwarzkopf Gliss Ultimate Repair - Strength Conditioner, 360ml",Schwarzkopf Gliss Ultimate Repair,,,,,,
GUXA4,Henkal Beauty,B0B4NT1P2H,"FA Deodorant Spray Men Attraction Force 150ml, Pack of 2",FA Deodorant Spray Men Attraction,,,,,,
GUXA4,Henkal Beauty,B07C1P5HKB,Palette Schwarzkopf Palette Intensive Color Creme 10-2 Ultra Ash Blonde,Palette Schwarzkopf Palette Inten,,,,,,
GUXA4,Henkal Beauty,B07C1PD1CR,Palette Schwarzkopf Palette Intensive Color Creme 7-0 Middle Blonde,Palette Schwarzkopf Palette Inten,,,,,,
GUXA4,Henkal Beauty,B0FHWGWBYN,Schwarzkopf Creme Supreme Full Kit Permanent Hair Coloration 8-0 Natural Blonde,Schwarzkopf Creme Supreme Full Ki,,,,,,
GUXA4,Henkal Beauty,B07NYZLMPW,Syoss Anti-hair fall shampoo 500ML for thinning hair,Syoss Anti-hair fall shampoo 500M,,,,,,
GUXA4,Henkal Beauty,B07MW2MWVH,Palette Schwarzkopf Palette Intensive Color Creme 1-1 Blue Black,Palette Schwarzkopf Palette Inten,,,,,,
GUXA4,Henkal Beauty,B07NQ7B5M5,"Syoss Renew 7 Shampoo + Conditioner, 500 ml",Syoss Renew 7 Shampoo + Condition,,,,,,
GUXA4,Henkal Beauty,B01NCHC5Y6,Palette Schwarzkopf Palette Intensive Color Creme 5-0 Light Brown,Palette Schwarzkopf Palette Inten,,,,,,
GUXA4,Henkal Beauty,B00YAJNXEW,Schwarzkopf Palette Intensive Color Creme 4-89 Intensive Aubergine,Schwarzkopf Palette Intensive Col,,,,,,
GUXA4,Henkal Beauty,B07P5S6VS8,Syoss Men Power Hold Sculpting-Gel 250Ml,Syoss Men Power Hold Sculpting-Ge,,,,,,
GUXA4,Henkal Beauty,B0FHWDX3N9,Schwarzkopf Creme Supreme Full Kit Permanent Hair Coloration 3-0 Natural Darkest Brown,Schwarzkopf Creme Supreme Full Ki,,,,,,
GUXA4,Henkal Beauty,B0FHWD35QD,Schwarzkopf Creme Supreme Full Kit Permanent Hair Coloration 8-16 Cool Ash Blonde,Schwarzkopf Creme Supreme Full Ki,,,,,,
GUXA4,Henkal Beauty,B0FHWHCW76,Schwarzkopf Creme Supreme Full Kit Permanent Hair Coloration 6-88 Intensive Red,Schwarzkopf Creme Supreme Full Ki,,,,,,
GUXA4,Henkal Beauty,B0FHW93NZ4,Schwarzkopf Creme Supreme Full Kit Permanent Hair Coloration 5-1 Cool Brown,Schwarzkopf Creme Supreme Full Ki,,,,,,
GUXA4,Henkal Beauty,B0B4NST18G,"FA Deodorant Spray Caribbean Lemon 150ml, Pack of 2",FA Deodorant Spray Caribbean Lemo,,,,,,
GUXA4,Henkal Beauty,B07NW86JB1,"Taft Wet Look Effect Styling Gel, 150 ml","Taft Wet Look Effect Styling Gel,",,,,,,
GUXA4,Henkal Beauty,B0B28QY41W,"Pert Plus Daily Care Shampoo 1L with Honey, Green",Pert Plus Daily Care Shampoo 1L w,,,,,,
GUXA4,Henkal Beauty,B00UJKS2S8,Palette Intensive Color Creme 4-0 Medium Brown,Palette Intensive Color Creme 4-0,,,,,,
GUXA4,Henkal Beauty,B013W9BJ32,Taft Schwarzkopf Taft Hairspray Phyto-Keratin 250 ml Hold 4,Taft Schwarzkopf Taft Hairspray P,,,,,,
GUXA4,Henkal Beauty,B07C1T1GNQ,"Palette Schwarzkopf Palette Intensive Color Creme 8-1 Light Blonde Cendre, 110 Ml",Palette Schwarzkopf Palette Inten,,,,,,
GUXA4,Henkal Beauty,B0DWG2S57V,"Schwarzkopf Gliss 4-in-1 Nourishment Bond-Building Hair Butter, 400ml",Schwarzkopf Gliss 4-in-1 Nourishm,,,,,,
GUXA4,Henkal Beauty,B08VZZT9Q2,"Schwarzkopf Gliss Daily Oil Elixir, 75ml",Schwarzkopf Gliss Daily Oil Elixi,,,,,,
GUXA4,Henkal Beauty,B0FHW9R9YT,Schwarzkopf Creme Supreme Full Kit Permanent Hair Coloration 5-0 Natural Brown,Schwarzkopf Creme Supreme Full Ki,,,,,,
GUXA4,Henkal Beauty,B0FHWG8TTV,Schwarzkopf Creme Supreme Full Kit Permanent Hair Coloration 9-0 Natural Light Blonde,Schwarzkopf Creme Supreme Full Ki,,,,,,
GUXA4,Henkal Beauty,B0BN7ZGL6B,"Fa Roll On Orchid 50ml, Pack of 2","Fa Roll On Orchid 50ml, Pack of 2",,,,,,
GUXA4,Henkal Beauty,B0BN3G3P7J,"Fa Shower Gel Cocoa Butter 250ml, Pack of 2, 1.0 count, 1","Fa Shower Gel Cocoa Butter 250ml,",,,,,,
GUXA4,Henkal Beauty,B0B28P8BL8,"PERT Plus Anti dandruff Shampoo 1L with Coconut oil and lemon extract, Green",PERT Plus Anti dandruff Shampoo 1,,,,,,
GUXA4,Henkal Beauty,B07G2HQBNN,Palette Schwarzkopf Palette Intensive Color Creme 10-1 Frosty Silver Blonde,Palette Schwarzkopf Palette Inten,,,,,,
GUXA4,Henkal Beauty,B07NF7KX2T,"Fa Shower Gel Vanilla Honey Yoghurt, 500ML",Fa Shower Gel Vanilla Honey Yoghu,,,,,,
GUXA4,Henkal Beauty,B01EFOKMIQ,Syoss Renew 7 shampoo 500ML for multi-damaged hair,Syoss Renew 7 shampoo 500ML for m,,,,,,
GUXA4,Henkal Beauty,B0B28PLZDX,"Pert Plus Length & Strength Shampoo 1L with Almond oil, Green",Pert Plus Length & Strength Shamp,,,,,,
GUXA4,Henkal Beauty,B0B28R7CBK,"Pert Plus Deep Nourishment Shampoo 1L with Olive oil for dry hair, Green",Pert Plus Deep Nourishment Shampo,,,,,,
GUXA4,Henkal Beauty,B0000691J1,"Fa Deospray Aqua, 200Ml","Fa Deospray Aqua, 200Ml",,,,,,
GUXA4,Henkal Beauty,B0FHWFGRST,Schwarzkopf Creme Supreme Full Kit Permanent Hair Coloration 1-0 Natural Black,Schwarzkopf Creme Supreme Full Ki,,,,,,
GUXA4,Henkal Beauty,B0BN7YNRLP,"Fa Roll On Invisible 50ml, Pack of 2","Fa Roll On Invisible 50ml, Pack o",,,,,,
GUXA4,Henkal Beauty,B07LG6B2V9,Palette Schwarzkopf Palette Naturals 7-0 Medium Blonde,Palette Schwarzkopf Palette Natur,,,,,,
GUXA4,Henkal Beauty,B0DWG3KW1B,"Schwarzkopf Gliss Aqua Revive - Moisture Conditioner, 360ml",Schwarzkopf Gliss Aqua Revive - M,,,,,,
GUXA4,Henkal Beauty,B01B9SOG42,Got2B Schwarzkopf Spiking Wax Glued 75Ml,Got2B Schwarzkopf Spiking Wax Glu,,,,,,
GUXA4,Henkal Beauty,B010FK1V4S,Fa Deodorant 1.7Oz Roll-On Mystic Moments,Fa Deodorant 1.7Oz Roll-On Mystic,,,,,,
GUXA4,Henkal Beauty,B0B4NR5GY5,"Fa Deodorant Spray Sport 150ml, Pack of 2","Fa Deodorant Spray Sport 150ml, P",,,,,,
GUXA4,Henkal Beauty,B07NDPQ71D,"Fa Deospray Mystic Moments, 200Ml","Fa Deospray Mystic Moments, 200Ml",,,,,,
GUXA4,Henkal Beauty,B07N6LFM4D,Pert Plus Purifying Shampoo With Mandarin Extract For Greasy Hair 400Ml,Pert Plus Purifying Shampoo With ,,,,,,
GUXA4,Henkal Beauty,B07LG5NDD6,Schwarzkopf Palette Intensive Color Creme 4-88 Dark Red,Schwarzkopf Palette Intensive Col,,,,,,
GUXA4,Henkal Beauty,B07G29PSW5,Palette Schwarzkopf Palette Intensive Color Creme 9-0 Extra Light Blonde,Palette Schwarzkopf Palette Inten,,,,,,
GUXA4,Henkal Beauty,B0BN3CD44N,"Fa shower gel aloe vera 250ml, pack of 2","Fa shower gel aloe vera 250ml, pa",,,,,,
GUXA4,Henkal Beauty,B0DG5BGM1C,"Schwarzkopf Gliss Aqua Revive - Moisture Shampoo, 400ml",Schwarzkopf Gliss Aqua Revive - M,,,,,,
GUXA4,Henkal Beauty,B0DWG2KZF5,"Schwarzkopf Gliss Split Hair Miracle - Sealing Conditioner, 360ml",Schwarzkopf Gliss Split Hair Mira,,,,,,
GUXA4,Henkal Beauty,B08VZJWCFM,"Schwarzkopf Gliss Oil Nutritive - Express Repair Conditioner, 200ml",Schwarzkopf Gliss Oil Nutritive -,,,,,,
GUXA4,Henkal Beauty,B0DWG1J2DT,"Schwarzkopf Gliss Full Hair Wonder -Antihair Fall Shampoo, 400ml",Schwarzkopf Gliss Full Hair Wonde,,,,,,
GUXA4,Henkal Beauty,B0BN8B95J6,"Fa Roll On Aqua 50ml, Pack of 2","Fa Roll On Aqua 50ml, Pack of 2",,,,,,
GUXA4,Henkal Beauty,B00YAJ1FF6,Palette Schwarzkopf Palette Intensive Color Creme 8-0 Light Blonde,Palette Schwarzkopf Palette Inten,,,,,,
GUXA4,Henkal Beauty,B0DWFZK3FJ,"Schwarzkopf Gliss Full Hair Wonder -Antihair Fall Conditioner, 360ml",Schwarzkopf Gliss Full Hair Wonde,,,,,,
GUXA4,Henkal Beauty,B07N5X6X6J,Palette Schwarzkopf Palette Intensive Color Creme 3-68 Dark Mahogany,Palette Schwarzkopf Palette Inten,,,,,,
GUXA4,Henkal Beauty,B0DWG2ZCRP,"Schwarzkopf Gliss Night Elixir Overnight Moisture, 100ml",Schwarzkopf Gliss Night Elixir Ov,,,,,,
GUXA4,Henkal Beauty,B07N5XY5Q1,"Palette Permanent Naturals Color Cream 10-4, Super Beige Blonde,110 ml",Palette Permanent Naturals Color ,,,,,,
GUXA4,Henkal Beauty,B017XSHWAM,Syoss Keratin Conditioner 500ML For Easily Breaking Hair,Syoss Keratin Conditioner 500ML F,,,,,,
GUXA4,Henkal Beauty,B0BN7XY5B2,"Fa Roll On Men Attraction 50ml, Pack of 2","Fa Roll On Men Attraction 50ml, P",,,,,,
GUXA4,Henkal Beauty,B07N5V3339,Schwarzkopf Palette Naturals 3-0 Dark Brown,Schwarzkopf Palette Naturals 3-0 ,,,,,,
GUXA4,Henkal Beauty,B078G3HPQ3,"Pert Plus Shampoo - Ginger, 600ml","Pert Plus Shampoo - Ginger, 600ml",,,,,,
GUXA4,Henkal Beauty,B07NW86H54,"Taft Looks Stand Up Look Power Gel Mega Strong, 150 ml",Taft Looks Stand Up Look Power Ge,,,,,,
GUXA4,Henkal Beauty,B0B4NQVLTX,"FA Deodorant Spray Floral & Protect Orchid 150ml, Pack of 2",FA Deodorant Spray Floral & Prote,,,,,,
GUXA4,Henkal Beauty,B0D2R8XF4N,Palette Intensive Color Cream 9-1 Extra light Blonde,Palette Intensive Color Cream 9-1,,,,,,
GUXA4,Henkal Beauty,B0DWFZLZTT,"Schwarzkopf Gliss Split Hair Miracle - Sealing Shampoo, 400ml",Schwarzkopf Gliss Split Hair Mira,,,,,,
GUXA4,Henkal Beauty,B07N5X87NV,Palette Schwarzkopf Palette Intensive Color Creme 7-17 Soft Brouge,Palette Schwarzkopf Palette Inten,,,,,,
GUXA4,Henkal Beauty,B0000WUS50,Fa Deodorant Roll-On - Aqua 50Ml,Fa Deodorant Roll-On - Aqua 50Ml,,,,,,
GUXA4,Henkal Beauty,B0006PKH7K,"Fa Roll On Sport, 50Ml","Fa Roll On Sport, 50Ml",,,,,,
GUXA4,Henkal Beauty,B00UJKS4EK,Palette Schwarzkopf Palette Intensive Color Creme 4-60 LUStroUS Middle Brown,Palette Schwarzkopf Palette Inten,,,,,,
GUXA4,Henkal Beauty,B07MW3CKV9,Palette Schwarzkopf Palette Intensive Color Creme 6-80 Marsala Brown,Palette Schwarzkopf Palette Inten,,,,,,
GUXA4,Henkal Beauty,B07N5V35RB,Palette Schwarzkopf Palette Naturals 1-0 Black,Palette Schwarzkopf Palette Natur,,,,,,
GUXA4,Henkal Beauty,B07N5TB9GD,Palette Schwarzkopf Palette Naturals 8-0 Light Blonde,Palette Schwarzkopf Palette Natur,,,,,,
GUXA4,Henkal Beauty,B0DWFZRX3T,"Schwarzkopf Gliss 4-in-1 Moisture Bond-Building Mask, 400ml",Schwarzkopf Gliss 4-in-1 Moisture,,,,,,
GUXA4,Henkal Beauty,B07K4QRCVT,Syoss Anti-Hair Fall Conditioner 500ML For Thinning Hair,Syoss Anti-Hair Fall Conditioner ,,,,,,
GUXA4,Henkal Beauty,B07G2KTWQ9,Palette Schwarzkopf Palette Intensive Color Creme 7-65 Sparkling Nougat,Palette Schwarzkopf Palette Inten,,,,,,
GUXA4,Henkal Beauty,B07N6JXF7S,Pert PlUS Anti-Dandruff Shampoo With Coconut Oil And Lemon Extract 400Ml,Pert PlUS Anti-Dandruff Shampoo W,,,,,,
GUXA4,Henkal Beauty,B0009VNI54,Fa Deodorant Roll On 50ml Caribbean Lemon,Fa Deodorant Roll On 50ml Caribbe,,,,,,
GUXA4,Henkal Beauty,B077L8FZZ4,Pert Plus Purifying Shampoo with Mandarin Extract For Greasy Hair 600ml,Pert Plus Purifying Shampoo with ,,,,,,
GUXA4,Henkal Beauty,B0B4NQ7MLX,"Fa Deodorant Spray Invisibile Power 150ml, Pack of 2",Fa Deodorant Spray Invisibile Pow,,,,,,
GUXA4,Henkal Beauty,B0CLLTYYD4,"Schwarzkopf Gliss Aqua Revive - Express Repair Conditioner, 200ml",Schwarzkopf Gliss Aqua Revive - E,,,,,,
GUXA4,Henkal Beauty,B00U2LVKCO,Syoss Repair Conditioner 500Ml For Dry And Damaged Hair,Syoss Repair Conditioner 500Ml Fo,,,,,,
GUXA4,Henkal Beauty,B09815LXH6,"Palette Schwarzkopf Palette Permanent Natural Colors Cream 6.68, Caramel Brown,110 ml",Palette Schwarzkopf Palette Perma,,,,,,
GUXA4,Henkal Beauty,B003BQNBGK,"Fa Aloe Vera Yougurt Shower Gel, 250 ML","Fa Aloe Vera Yougurt Shower Gel, ",,,,,,
GUXA4,Henkal Beauty,B0B8NSM2FG,Palette Schwarzkopf Palette Naturals 10-0 Extra Light Blonde,Palette Schwarzkopf Palette Natur,,,,,,
GUXA4,Henkal Beauty,B01GTT9V64,"Taft Ultra Wax For Wet Or Dry Hair, 75 ml",Taft Ultra Wax For Wet Or Dry Hai,,,,,,
GUXA4,Henkal Beauty,B09XRCXHJ2,"Pert Plus Deep Nourishment Conditioner for Dry Hair with Olive Oil and Rosemary Extract, 360ml",Pert Plus Deep Nourishment Condit,,,,,,
GUXA4,Henkal Beauty,B09XRD7MKP,"Pert Plus Intense Repair Conditioner with Argan Oil, 360ML",Pert Plus Intense Repair Conditio,,,,,,
GUXA4,Henkal Beauty,B07K4DHY64,Syoss Ceramide Shampoo 500Ml For Weak Hair,Syoss Ceramide Shampoo 500Ml For ,,,,,,
GUXA4,Henkal Beauty,B07MVYY5JL,Pert Plus Strength & Shine Shampoo With Henna And HibiscUS Extract 400Ml,Pert Plus Strength & Shine Shampo,,,,,,
GUXA4,Henkal Beauty,B07FZPDLV8,Pert Plus Deep Nourishment Shampoo with Olive Oil For Dry Hair 400ml,Pert Plus Deep Nourishment Shampo,,,,,,
GUXA4,Henkal Beauty,B07FZP29BV,"Pert Plus Shampoo - Honey, 600ml","Pert Plus Shampoo - Honey, 600ml",,,,,,
GUXA4,Henkal Beauty,B08C84WXVL,Pert Plus Daily Care Shampoo with Honey 200ml,Pert Plus Daily Care Shampoo with,,,,,,
GUXA4,Henkal Beauty,B07M7F1P84,Fa Floral Protect Orchid And Viola For Women 150 ml,Fa Floral Protect Orchid And Viol,,,,,,
GUXA4,Henkal Beauty,B07H1VHSYZ,Fa Shower Gel & Shampoo Kids Underwater Mermaid 250 ml,Fa Shower Gel & Shampoo Kids Unde,,,,,,
GUXA4,Henkal Beauty,B07N6J3LQT,Pert Plus Deep Nourishment Shampoo With Olive Oil For Dry Hair 200Ml,Pert Plus Deep Nourishment Shampo,,,,,,
GUXA4,Henkal Beauty,B07N6JWV8L,Pert PlUS Anti-Hair Fall Shampoo With Ginger Extract 200Ml,Pert PlUS Anti-Hair Fall Shampoo ,,,,,,
GUXA4,Henkal Beauty,B07N6JCW5F,Pert Plus Shampoo For Dry Hair - 200 ml,Pert Plus Shampoo For Dry Hair - ,,,,,,
GUXA4,Henkal Beauty,B07MVD9JFB,Pert Plus Length & Strength Shampoo with Almond Oil 400ml,Pert Plus Length & Strength Shamp,,,,,,
GUXA4,Henkal Beauty,B0FHWHK324,Schwarzkopf Creme Supreme Full Kit Permanent Hair Coloration 7-16 Cool Ash Dark Blonde,Schwarzkopf Creme Supreme Full Ki,,,,,,
GUXA4,Henkal Beauty,B01H597C6I,Got2B Schwarzkopf Matt Paste Beach Matt 100Ml,Got2B Schwarzkopf Matt Paste Beac,,,,,,
GUXA4,Henkal Beauty,B0BN7YRSTK,"Fa Roll On Caribbean Lemon 50ml, Pack of 2","Fa Roll On Caribbean Lemon 50ml, ",,,,,,
GUXA4,Henkal Beauty,B0018M24BC,"Fa Vanilla Honey Shower Cream, 250 Ml","Fa Vanilla Honey Shower Cream, 25",,,,,,
GUXA4,Henkal Beauty,B07NF5V9K3,Fa Shower Cream Cocoa Butter & Coco Cream & Oil 250 Ml,Fa Shower Cream Cocoa Butter & Co,,,,,,
GUXA4,Henkal Beauty,B0DWG1J8SQ,"Schwarzkopf Gliss Supreme Length - Protection Conditioner, 360ml",Schwarzkopf Gliss Supreme Length ,,,,,,
GUXA4,Henkal Beauty,B00OND693M,Fa Deodorant Spray Men Attraction Force 150 Ml,Fa Deodorant Spray Men Attraction,,,,,,
GUXA4,Henkal Beauty,B004VTW626,"Fa Sport Deodorant Spray, 150ml","Fa Sport Deodorant Spray, 150ml",,,,,,
GUXA4,Henkal Beauty,B003BV0YW4,Schwarzkopf Mass Market Schwarzkopf Got2B 220∞C Heat Protection Spray Guardian Angel 200Ml,Schwarzkopf Mass Market Schwarzko,,,,,,
GUXA4,Henkal Beauty,B0FHWFZC85,Schwarzkopf Creme Supreme Full Kit Permanent Hair Coloration 4-0 Natural Dark Brown,Schwarzkopf Creme Supreme Full Ki,,,,,,
GUXA4,Henkal Beauty,B07K467VDT,"Syoss Ceramide Conditioner for weak hair ,500ML",Syoss Ceramide Conditioner for we,,,,,,
GUXA4,Henkal Beauty,B07N5TXMLJ,Palette Schwarzkopf Palette Naturals 4-0 Medium Brown,Palette Schwarzkopf Palette Natur,,,,,,
GUXA4,Henkal Beauty,B07FZMTD9K,"Pert Plus Shampoo - Oil Extracts, 600ml","Pert Plus Shampoo - Oil Extracts,",,,,,,
GUXA4,Henkal Beauty,B07N5TY3BK,"Palette Permanent Natural Colours Cream 5.0, Light Brown,100 ml",Palette Permanent Natural Colours,,,,,,
GUXA4,Henkal Beauty,B07MVXXKP9,"Fa Roll On Orchid Viola, 50ml","Fa Roll On Orchid Viola, 50ml",,,,,,
GUXA4,Henkal Beauty,B0006MQ36C,"Fa Active Sport Shower Gel, 250 Ml","Fa Active Sport Shower Gel, 250 M",,,,,,
GUXA4,Henkal Beauty,B0762DLVD4,"Fa Brightening And Care Roll On, 50 ml","Fa Brightening And Care Roll On, ",,,,,,
GUXA4,Henkal Beauty,B0036RFMCA,"Got2B Ultra Glued Invincible Styling Hair Gel, 6 Ounce",Got2B Ultra Glued Invincible Styl,,,,,,
GUXA4,Henkal Beauty,B07627PSVT,Fa deodorant Roll On 50ml Soft & Control,Fa deodorant Roll On 50ml Soft & ,,,,,,
GUXA4,Henkal Beauty,B07LG63MWH,"Palette Permanent Natural Colours Cream 6.0, Dark Blond,100 ml",Palette Permanent Natural Colours,,,,,,
GUXA4,Henkal Beauty,B0BN3C1CJH,"Fa Shower Gel Sport 250ml, Pack of 2, 1.0 count","Fa Shower Gel Sport 250ml, Pack o",,,,,,
GUXA4,Henkal Beauty,B003DXTTDU,"Fa Deospray Pink Passion, 150Ml, 5 Ounces","Fa Deospray Pink Passion, 150Ml, ",,,,,,
