vendor_code,vendor_name,asin,item_name_raw,item_name_clean,brand,category,sub_category,pack_size,pack_unit,notes
T072Y,Champions,B08MBD4175,"Vitamin Well Upgrade Lemon/Cactus Vitamin B12 + D Magnesium + Zinc (VW Upgrade 500ML, Pack of 12)",Vitamin Well Upgrade Lemon/Cactus,,,,,,
T072Y,Champions,B086DVXG5K,"Vitamin Well Care Red Grapefruit Vitamin B12 + Zinc + Biotin + Folic Acid (VW CARE 500ML, Pack of 12)",Vitamin Well Care Red Grapefruit ,,,,,,
T072Y,Champions,B086DV7D1W,Vitamin Well Hydrate Rhubarb/Strawberry Vitamin C + D Zinc + Biotin (VW HYDRATE 500ML Pack of 12),Vitamin Well Hydrate Rhubarb/Stra,,,,,,
T072Y,Champions,B07DLJB7PC,Barebells Protein Milkshake 8 x 330ml Bottles| High Protein Shake | No Added Sugar | Lactose Free| 24g of Protein | Delicious Creamy Flavour (Banana),Barebells Protein Milkshake 8 x 3,,,,,,
T072Y,Champions,B0DMTC4NQB,Castello since 1907 - zero calorie liquid sweetener with Stevia - 30ml,Castello since 1907 - zero calori,,,,,,
T072Y,Champions,B0DTGMM5L1,Castello Since 1907 - Zero Calorie Stevia Sweetener - 300g,Castello Since 1907 - Zero Calori,,,,,,
T072Y,Champions,B0CH8RF9RZ,"Barebells Vegan Hazelnut & Nougat Protein Bar, 55g",Barebells Vegan Hazelnut & Nougat,,,,,,
T072Y,Champions,B0F331Z81L,"Barebells Protein Shake ñ 24g High Protein Milkshake, Lactose-Free, Ready to Drink, Low Carb ñ 8x330ml (Cookies & Cream)",Barebells Protein Shake ñ 24g Hig,,,,,,
T072Y,Champions,B0FS7DHXXJ,Vitamin Well Upgrade Lemon Cactus Flavor Vitamin B12 + D Magnesium + Zinc Low Calorie Drink 500 ml,Vitamin Well Upgrade Lemon Cactus,,,,,,
T072Y,Champions,B09FX1D4PF,Vitamin Well Drink Reload Lemon and Lime Piece Vitamin B + D Magnesium + Zinc (VW RELOAD 500ML),Vitamin Well Drink Reload Lemon a,,,,,,
T072Y,Champions,B07X5MH1BM,"Vitamin Well Antioxidant | Vitamin C + E, Selenium + Manganese | Healthy Drink | Functional Drinks | Protect your Body Cells ñ With a taste of Peach (Antioxidant | Peach, Pack of 12)",Vitamin Well Antioxidant | Vitami,,,,,,
T072Y,Champions,B08MKX6G7G,"Vitamin Well Reload Lemon/Lime Vitamin B + D Magnesium + Zinc (VW RELOAD 500ML, Pack of 12) Package design may vary",Vitamin Well Reload Lemon/Lime Vi,,,,,,
T072Y,Champions,B0BVQBSBV8,Barebells Barbells Protein Bars 55g x 12 Bars (Marshmallow),Barebells Barbells Protein Bars 5,,,,,,
T072Y,Champions,B07DLFZW31,Barebells Protein Milkshake 8 x 330ml Bottles| High Protein Shake | No Added Sugar | Lactose Free| 24g of Protein | Delicious Creamy Flavour (Chocolate),Barebells Protein Milkshake 8 x 3,,,,,,
T072Y,Champions,B0BFBDDGGN,Barebells Barbells Protein Bars 55g x 12 Bars (Soft Caramel),Barebells Barbells Protein Bars 5,,,,,,
T072Y,Champions,B072HWGV31,"Barebells Caramel Cashew High Protein and Low Carb Bar, 12 x 55g (1,94 oz) Low Sugar Snack P",Barebells Caramel Cashew High Pro,,,,,,
T072Y,Champions,B07MHKBDJV,Barebells Protein Milkshake 8 x 330ml Bottles| High Protein Shake | No Added Sugar | Lactose Free| 24g of Protein | Delicious Creamy Flavour (Vanilla),Barebells Protein Milkshake 8 x 3,,,,,,
T072Y,Champions,B07DLCVM1H,Barebells Protein Milkshake 8 x 330ml Bottles| High Protein Shake | No Added Sugar | Lactose Free| 24g of Protein | Delicious Creamy Flavour (STRAWBERRY),Barebells Protein Milkshake 8 x 3,,,,,,
T072Y,Champions,B07DLNH6L2,"Barebells Cookies & Cream High Protein and Low Carb Bar - 12 x 55g (1,94 oz) Low Sugar Snack Protein Bar with 20g protein",Barebells Cookies & Cream High Pr,,,,,,
T072Y,Champions,B088N7FT19,"Barebells Vegan Salty Peanut High Protein and Low Carb Bar, 12 x 55g (1,94 oz) No Sugar Snack Protein Bar with 15g protein",Barebells Vegan Salty Peanut High,,,,,,
T072Y,Champions,B088NNZW7B,"Barebells Vegan Hazelnut Nougat High Protein and Low Carb Bar, 12 x 55g (1,94 oz) No Sugar Snack Protein Bar with 15g protein",Barebells Vegan Hazelnut Nougat H,,,,,,
T072Y,Champions,B07FSPH47X,"Barebells White Chocolate Almond High Protein and Low Carb Bar, 12 x 55g (1,94 oz) Low Sugar Snack Protein Bar with 20g protein",Barebells White Chocolate Almond ,,,,,,
T072Y,Champions,B0DXBYBZN4,Vitamin Well Reload Lemon and Lime Drink 500ml Pack of 6,Vitamin Well Reload Lemon and Lim,,,,,,
T072Y,Champions,B07CD4K7HM,Rip Van Wafels Snickerdoodle Stroopwafels - Healthy Snacks Non GMO Snack Keto Friendly Office Low Sugar (3g) Calorie 12 Pack,Rip Van Wafels Snickerdoodle Stro,,,,,,
T072Y,Champions,B0DQR5L658,Castello since 1907 - Zero Calorie Stevia Sweetener - box of 60 sachets,Castello since 1907 - Zero Calori,,,,,,
T072Y,Champions,B0DTGL5G3D,Castello since 1907 - Zero Calorie Stevia Sweetener - box of 100 sachets,Castello since 1907 - Zero Calori,,,,,,
T072Y,Champions,B0CBKW4ZYB,"Barebells Salty Peanut Protein Bar, High Protein and Low Carb Bar, 12 x 55g (1,94 oz) Low Sugar Snack Protein Bar with 20g protein",Barebells Salty Peanut Protein Ba,,,,,,
T072Y,Champions,B0BYZS6GLT,Barebells Rocky Road Nutty Marshmellow Soft Protein Bar 55g,Barebells Rocky Road Nutty Marshm,,,,,,
T072Y,Champions,B0DXBRHMXT,Vitamin Well Hydrate Rhubarb and Strawberry Drink 500ml Pack of 6,Vitamin Well Hydrate Rhubarb and ,,,,,,
T072Y,Champions,B0977KZXYC,"Barebells DoubleBite Chocolate Crisp High Protein and Low Carb Bar, 12 x 55g 1,94 oz Low Sugar Snack Protein Bar with 16g protein Blue",Barebells DoubleBite Chocolate Cr,,,,,,
T072Y,Champions,B0D1HBJF5R,"Barebells Protein Cookies and Caramel - 12 Count, 1.9oz Bars - Protein Snacks with 20g of High Protein - Chocolate Protein Bar with 1g of Total Sugars - On The Go Protein Snack & Breakfast Bars",Barebells Protein Cookies and Car,,,,,,
T072Y,Champions,B01MQJPAOU,Rip Van Wafels Honey and Oats Stroopwafels - Healthy Snacks - Non GMO Snack - Keto Friendly - Office Snacks - Low Sugar (3g) - Low Calorie Snack - 12 Pack,Rip Van Wafels Honey and Oats Str,,,,,,
T072Y,Champions,B0CGK3WVSK,Barebells Barbells Protein Bars 55g x 12 Bars (Soft Salted Peanut Caramel),Barebells Barbells Protein Bars 5,,,,,,
T072Y,Champions,B07M85KKJ4,"Barebells Hazelnut & Nougat High Protein and Low Carb Bar, 12 x 55g (1,94 oz) Low Sugar Snack Protein Bar with 20g protein",Barebells Hazelnut & Nougat High ,,,,,,
T072Y,Champions,B07TDTX4R2,"Barebells Salty Peanut Protein Bar, High Protein and Low Carb Bar, 12 x 55g (1,94 oz) Low Sugar Snack Protein Bar with 20g protein",Barebells Salty Peanut Protein Ba,,,,,,
T072Y,Champions,B0DTDTZGMQ,"Barebells Protein Bars, Creamy Crisp - Bars with 20g of High Protein - Perfect on The Go Protein Snack & Breakfast Bar, 55g","Barebells Protein Bars, Creamy Cr",,,,,,
T072Y,Champions,B0D3QVP733,Barbells Soft Bar Caramel Choco 55g,Barbells Soft Bar Caramel Choco 5,,,,,,
T072Y,Champions,B07Q4Q591H,"Barebells Salty Peanut High Protein and Low Carb Bar, 55g (1,94 oz) Low Sugar Snack Protein Bar with 20g protein",Barebells Salty Peanut High Prote,,,,,,
T072Y,Champions,B0DQLLVRXB,"Barebells Cookies & Cream Protein Bar, 55g",Barebells Cookies & Cream Protein,,,,,,
T072Y,Champions,B07Q4QJ7KV,"Barebells Cookies & Cream High Protein and Low Carb Bar, 55g (1,94 oz) Low Sugar Snack Protein Bar with 20g protein",Barebells Cookies & Cream High Pr,,,,,,
T072Y,Champions,B0DWXBKCLF,"QMIN*C Ginger Flavor Juice Drink, Pack of 6, 150ml Each, 900ml Total, Bottle Container, Immunity & Energy Booster","QMIN*C Ginger Flavor Juice Drink,",,,,,,
T072Y,Champions,B0DN9HZPYH,"Barebells Chocolate Protein Milkshake, 330 ml",Barebells Chocolate Protein Milks,,,,,,
T072Y,Champions,B0F13HJBN1,"Lacnor Mix Berries Fruit Drink, 180ml","Lacnor Mix Berries Fruit Drink, 1",,,,,,
T072Y,Champions,B07Q3S7RLD,Barebells Caramel Cashew Protein Bar - High Protein and Low Carb Bar - 55g Protein Bar with 20g protein,Barebells Caramel Cashew Protein ,,,,,,
T072Y,Champions,B0F793ZNSD,"Barebells Protein Bars, 16g Protein, Sugar Free Chocolate, Low Carb, 12 Pack x 55g, Coco Choco Flavour","Barebells Protein Bars, 16g Prote",,,,,,
T072Y,Champions,B07G4GNKHT,"Barebells White Chocolate Almond Protein Bar, 55g",Barebells White Chocolate Almond ,,,,,,
T072Y,Champions,B07WRL9XZG,"Barebells Hazelnut & Nougat High Protein and Low Carb Bar, Low Sugar Snack Protein Bar with 20g protein, 55g",Barebells Hazelnut & Nougat High ,,,,,,
T072Y,Champions,B07Q6Z4LPB,"Barebells White Chocolate Almond High Protein and Low Carb Bar, 55g Low Sugar Snack Protein Bar with 20g protein",Barebells White Chocolate Almond ,,,,,,
T072Y,Champions,B0CH8T3XXZ,"Barebells Vegan Salty Peanut Protein Bar, 55g",Barebells Vegan Salty Peanut Prot,,,,,,
T072Y,Champions,B09MWMV1DG,"Barebells White Salty Peanut High Protein and Low Carb Bar, 12 x 55g (1,94 oz) Low Sugar Snack Protein Bar with 20g protein",Barebells White Salty Peanut High,,,,,,
T072Y,Champions,B09FX639YN,QualityFood Vitamin Well Drink Antioxidant Peach 500ml Piece,QualityFood Vitamin Well Drink An,,,,,,
T072Y,Champions,B0BD8QGVR6,"Barebells White Salty Peanut High Protein and Low Carb Bar, Low Sugar Snack Protein Bar with 20g protein, 55g",Barebells White Salty Peanut High,,,,,,
T072Y,Champions,B09FX76VQN,Vitamin Well Hydrate Rhubarb/Strawberry Vitamin C + D Zinc + Biotin 500ML,Vitamin Well Hydrate Rhubarb/Stra,,,,,,
T072Y,Champions,B01N531XR0,Rip Van Wafels Dutch Caramel & Vanilla Stroopwafels - Healthy Snacks - Non GMO Snack - Keto Friendly - Office Snacks - Low Sugar (3g) - Low Calorie Snack - 12 Count,Rip Van Wafels Dutch Caramel & Va,,,,,,
T072Y,Champions,B07KDKSTS7,"Barebells Protein Bars Caramel Cashew, 1.9oz Bars with 20g of High Protein - Chocolate Protein Bar with 1g of Total Sugars - Perfect on The Go Protein Snack & Breakfast Bar, 55g",Barebells Protein Bars Caramel Ca,,,,,,
UNW77,United,B0DHD7YZ1F,Deep Fresh Baby Wipes Lovely Baby Flip-Top Pack,Deep Fresh Baby Wipes Lovely Baby,,,,,,
UNW77,United,B07NDNRNTD,"Revlon Padel Brush, RV2979UKE3","Revlon Padel Brush, RV2979UKE3",,,,,,
UNW77,United,B08Y8HDXQP,"Revlon All Purpose Hair Brush, RV2975UKE3","Revlon All Purpose Hair Brush, RV",,,,,,
UNW77,United,B07MW1H752,"Revlon Hair Brush, RV2974UKE3","Revlon Hair Brush, RV2974UKE3",,,,,,
UNW77,United,B07NDPFNSX,"Revlon Oval Brush, RV2980UKE3","Revlon Oval Brush, RV2980UKE3",,,,,,
UNW77,United,B07NDPBD8W,"Revlon Flat Bristal Hair Brush, RV2976UKE3","Revlon Flat Bristal Hair Brush, R",,,,,,
UNW77,United,B08Y8GY8W8,"Revlon Medium Tooth Comb, RV3000UKE","Revlon Medium Tooth Comb, RV3000U",,,,,,
UNW77,United,B01518XZPM,"Flying Goose Sriracha Super Hot Chilli Sauce, 455ml",Flying Goose Sriracha Super Hot C,,,,,,
UNW77,United,B07NDNWN6P,"Revlon All Purpose Hair Brush, RV2982UKE3","Revlon All Purpose Hair Brush, RV",,,,,,
UNW77,United,B07NDP4MYC,"Revlon Padel Hair Brush, RV2977UKE3","Revlon Padel Hair Brush, RV2977UK",,,,,,
UNW77,United,B087S5SKFB,"Deep Fresh Liquid Hand Wash Fig Fragrance, 500ml",Deep Fresh Liquid Hand Wash Fig F,,,,,,
UNW77,United,B087S59DTX,"Deep Fresh Liquid Hand Wash Grape Fragrance, 500ml",Deep Fresh Liquid Hand Wash Grape,,,,,,
UNW77,United,B087S5BVMD,"Deep Fresh Liquid Hand Wash Lemon Fragrance, 500ml",Deep Fresh Liquid Hand Wash Lemon,,,,,,
UNW77,United,B086LZYR12,"Aseel Premium Tahina, 450gm","Aseel Premium Tahina, 450gm",,,,,,
UNW77,United,B08N7RHFKR,"Deep Fresh Herbal Shampoo Coconut, 500ml",Deep Fresh Herbal Shampoo Coconut,,,,,,
UNW77,United,B087S4ZLJ2,"Deep Fresh Herbal Shampoo Olive, 500ml","Deep Fresh Herbal Shampoo Olive, ",,,,,,
UNW77,United,B087SPHVF1,"Supersun Cooking & Frying Oil, 1.8 L","Supersun Cooking & Frying Oil, 1.",,,,,,
UNW77,United,B07PKDLS5C,Aseel Pure Butter Ghee 400ml,Aseel Pure Butter Ghee 400ml,,,,,,
UNW77,United,B08W5G6S6G,"Nawar Sunflower Oil, 1.5 Litres","Nawar Sunflower Oil, 1.5 Litres",,,,,,
UNW77,United,B07NF63VRH,"Aseel Extra Virgin Olive Oil, 500 ml","Aseel Extra Virgin Olive Oil, 500",,,,,,
UNW77,United,B08W5G24JK,"Aseel Canola Oil, 1.5 Litre PET","Aseel Canola Oil, 1.5 Litre PET",,,,,,
UNW77,United,B08W5HWPVV,"Safi Corn Oil, 1.5 Litre PET","Safi Corn Oil, 1.5 Litre PET",,,,,,
UNW77,United,B07PH34VMB,"Aseel Premium Tahina, 900 gm","Aseel Premium Tahina, 900 gm",,,,,,
UNW77,United,B07NDN6XYT,"Revlon Tunnel Vent Hair Brush, RV2981UKE3","Revlon Tunnel Vent Hair Brush, RV",,,,,,
UNW77,United,B08W5HJY38,"Aseel Canola Oil, Twin Combo Pack of 2 x 1.5 Litres PET","Aseel Canola Oil, Twin Combo Pack",,,,,,
UNW77,United,B07NF7YZT2,"SuperSun Cooking Oil, 5 Litre, 5 liter","SuperSun Cooking Oil, 5 Litre, 5 ",,,,,,
UNW77,United,B08X6FLZHT,REVLON BCA Vision Square Hand Mirror,REVLON BCA Vision Square Hand Mir,,,,,,
UNW77,United,B086M21NGT,Aseel Pure Butter Ghee 800ml,Aseel Pure Butter Ghee 800ml,,,,,,
UNW77,United,B08GGNN8ZB,"Flying Goose Salsa De Chile Sriracha, Black Pepper 225 g",Flying Goose Salsa De Chile Srira,,,,,,
UNW77,United,B08W5J7NN6,"Safi Corn Oil, Twin Combo Pack of 2 x 1.5 Litre PET","Safi Corn Oil, Twin Combo Pack of",,,,,,
UNW77,United,B08W5G5HG6,"Aseel Corn Oil, 1.5 Litre","Aseel Corn Oil, 1.5 Litre",,,,,,
UNW77,United,B08W5J54WM,"Nawar Sunflower Oil, 4 Litres PET","Nawar Sunflower Oil, 4 Litres PET",,,,,,
UNW77,United,B088HQT72Q,"Nawar Sunflower Oil, 5 Litre","Nawar Sunflower Oil, 5 Litre",,,,,,
UNW77,United,B07P8BRHXT,"Safi Corn Oil, 5 Liter","Safi Corn Oil, 5 Liter",,,,,,
UNW77,United,B086TH1NWD,Aseel Pure Butter Ghee 1.6Litre,Aseel Pure Butter Ghee 1.6Litre,,,,,,
UNW77,United,B07PFXKWCH,"Aseel Pomace Olive Oil, 5 Liter","Aseel Pomace Olive Oil, 5 Liter",,,,,,
UNW77,United,B0BZPRDN9L,"Aseel Pure Ghee, 800ml +10% Extra","Aseel Pure Ghee, 800ml +10% Extra",,,,,,
UNW77,United,B0D4V9RSP5,"Aseel Pure Ghee, Twin Pack of 2 x 400ml","Aseel Pure Ghee, Twin Pack of 2 x",,,,,,
UNW77,United,B0BZRX9N9V,"Aseel Vegetable Ghee, 1.15 Litre","Aseel Vegetable Ghee, 1.15 Litre",,,,,,
UNW77,United,B0D6R954TN,"Aseel Canola Oil, 3 Litres","Aseel Canola Oil, 3 Litres",,,,,,
UNW77,United,B0FDGJFSFJ,Aseel Premium Tahina Combo 2 x 450 g,Aseel Premium Tahina Combo 2 x 45,,,,,,
UNW77,United,B0FDGKJVS1,Mumtaz Evaporated Milk 48 x 170 g,Mumtaz Evaporated Milk 48 x 170 g,,,,,,
UNW77,United,B0D6R972QL,"Nawar Sunflower Oil, 3 Litres","Nawar Sunflower Oil, 3 Litres",,,,,,
UNW77,United,B0D5D11GKZ,"Aseel Vegetable Ghee, 2.3 Litres","Aseel Vegetable Ghee, 2.3 Litres",,,,,,
UNW77,United,B0D6R8MSVW,"Mumtaz Vegetable Oil, 5 Litres HDPE bottle","Mumtaz Vegetable Oil, 5 Litres HD",,,,,,
UNW77,United,B0DH1SYNVQ,"Aseel Vegetable Ghee, Twin Pack of 2 x 500ml","Aseel Vegetable Ghee, Twin Pack o",,,,,,
UNW77,United,B09BLYMFPT,"Supersun Cooking Oil, 4 L PET (Promo)","Supersun Cooking Oil, 4 L PET (Pr",,,,,,
UNW77,United,B0FDGG133S,Aseel Extra Virgin Olive Oil 2 x 500 ml,Aseel Extra Virgin Olive Oil 2 x ,,,,,,
UNW77,United,B0D6R8Z9C3,"Aseel Corn Oil, 1.5L","Aseel Corn Oil, 1.5L",,,,,,
UNW77,United,B0D5D1P8XQ,"Aseel Vegetable Ghee, 2 Litres","Aseel Vegetable Ghee, 2 Litres",,,,,,
UNW77,United,B0BRVJF524,"Aseel Vegetable Ghee, 1 Litre","Aseel Vegetable Ghee, 1 Litre",,,,,,
UNW77,United,B0D6VF9843,"Flying Goose Sriracha Sweet Chilli, 200ml",Flying Goose Sriracha Sweet Chill,,,,,,
UNW77,United,B0D5CZJKZY,"Aseel Veg Ghee (Canola Oil), 1 Litre","Aseel Veg Ghee (Canola Oil), 1 Li",,,,,,
UNW77,United,B0D6R9CXRN,"Mumtaz Vegetable Oil, 1.5 Litre PET Bottle","Mumtaz Vegetable Oil, 1.5 Litre P",,,,,,
UNW77,United,B07NDPD9VY,"Revlon Styling Comb, RV2990UKE2","Revlon Styling Comb, RV2990UKE2",,,,,,
UNW77,United,B087S35CJN,"Deep Fresh Exfoliating Shower Gel Strawberry Fragrance, 400ml",Deep Fresh Exfoliating Shower Gel,,,,,,
UNW77,United,B09WV3KSX6,"Deep Fresh Oriental Shower Gel Amber, 400ml",Deep Fresh Oriental Shower Gel Am,,,,,,
UNW77,United,B09WV2L6S3,"Deep Fresh Oriental Shower Gel Oud Fragrance, 400ml",Deep Fresh Oriental Shower Gel Ou,,,,,,
UNW77,United,B00JLGB094,"Aseel Ghee, 500 ml","Aseel Ghee, 500 ml",,,,,,
UNW77,United,B08W5HVMH7,"Aseel Sunflower Cooking Oil, 1.5L - Pack of 2","Aseel Sunflower Cooking Oil, 1.5L",,,,,,
UNW77,United,B089SPPR1Q,"Abevia Evaporated Milk, 410gm by Nutridor","Abevia Evaporated Milk, 410gm by ",,,,,,
UNW77,United,B08897712L,NUTRIDOR ABEVIA Evaporated Milk 170g Easy Open,NUTRIDOR ABEVIA Evaporated Milk 1,,,,,,
UNW77,United,B08W5HY7CG,"Nawar Sunflower Oil, Twin Combo Pack of 2 x 1.5 Litres","Nawar Sunflower Oil, Twin Combo P",,,,,,
UNW77,United,B0FDGFCMMD,Aseel Pomace Olive Oil 500 ml,Aseel Pomace Olive Oil 500 ml,,,,,,
UNW77,United,B07S21F8XQ,"Flying Goose Sriracha Black Out Sauce, 200ml",Flying Goose Sriracha Black Out S,,,,,,
UNW77,United,B07S424VYV,Flying Goose Sriracha Black 200ml,Flying Goose Sriracha Black 200ml,,,,,,
UNW77,United,B0FDGHMK11,Mumtaz Evaporated Milk 48 x 410 g,Mumtaz Evaporated Milk 48 x 410 g,,,,,,
UNW77,United,B0CNLR3G74,"Supersun Cooking & Frying Oil, 3 Litres","Supersun Cooking & Frying Oil, 3 ",,,,,,
UNW77,United,B07NF7VR5B,"Aseel Olive Oil Extra Virgin, 250ml","Aseel Olive Oil Extra Virgin, 250",,,,,,
UNW77,United,B0FDGFXYR6,Aseel Pomace Olive Oil 500 ml,Aseel Pomace Olive Oil 500 ml,,,,,,
UNW77,United,B00BQH1H2G,Aseel Canola Oil 750 ml,Aseel Canola Oil 750 ml,,,,,,
UNW77,United,B0CTMT8KF4,"Aseel Tahina Premium, 2 x 450 g","Aseel Tahina Premium, 2 x 450 g",,,,,,
UNW77,United,B0D5CY58B1,"Aseel Vegetable Ghee With Sunflower Oil, 1 Litre",Aseel Vegetable Ghee With Sunflow,,,,,,
UNW77,United,B0FDGHMYY6,Flying Goose Sriracha Super Hot Chili Sauce 2 x 200 ml,Flying Goose Sriracha Super Hot C,,,,,,
UNW77,United,B0FDGG86M7,Flying Goose Regular Sriracha Chili Sauce 2 x 200 ml,Flying Goose Regular Sriracha Chi,,,,,,
UNW77,United,B0FDGGWP3L,Flying Goose Sriracha Mayo Combo 2 x 200 ml,Flying Goose Sriracha Mayo Combo ,,,,,,
UNW77,United,B0D6R9ZYQG,"Nawar Sunflower Oil, 750ml","Nawar Sunflower Oil, 750ml",,,,,,
UNW77,United,B0BC1JHGN5,Aseel Vegetable Ghee 500ml,Aseel Vegetable Ghee 500ml,,,,,,
UNW77,United,B01MRIHTBK,"Flying Goose Sriracha Regular Chili Sauce, 200 ml",Flying Goose Sriracha Regular Chi,,,,,,
UNW77,United,B01MRIHRG0,"Flying Goose Sriracha Sauce Extra Garlic, 200 ml",Flying Goose Sriracha Sauce Extra,,,,,,
UNW77,United,B07YNY64B7,"Flying Goose Sriracha Super Hot Chilli Sauce, 200ml",Flying Goose Sriracha Super Hot C,,,,,,
UNW77,United,B07JMV8DRN,"Flying Goose Sriracha Regular Hot Chilli Sauce, 730ml",Flying Goose Sriracha Regular Hot,,,,,,
UNW77,United,B07NF8PC2D,"Aseel Extra Virgin Olive Oil, 500 ml","Aseel Extra Virgin Olive Oil, 500",,,,,,
UNW77,United,B004BTMYVO,"Flying Goose Sriracha Chili Sauce Regular, 455ml",Flying Goose Sriracha Chili Sauce,,,,,,
UNW77,United,B01JUPZMDA,"Flying Goose Vegan Sriracha Mayo, 200 ml","Flying Goose Vegan Sriracha Mayo,",,,,,,
UNW77,United,B088HSZQMR,"Aseel Pomace Olive Oil, 5 Liter","Aseel Pomace Olive Oil, 5 Liter",,,,,,
KY2O0,McLane,B09P8GQ4TK,M.C. Trader 100% Avocado Oil 1L,M.C. Trader 100% Avocado Oil 1L,,,,,,
KY2O0,McLane,B08H321LHY,"M.C. Trader 100% Avocado Oil, 500 ml","M.C. Trader 100% Avocado Oil, 500",,,,,,
KY2O0,McLane,B00BLK5E7W,"Gerber Lil' Bits Baby Cereal, Oatmeal Banana Strawberry, 8 Ounce, large","Gerber Lil' Bits Baby Cereal, Oat",,,,,,
KY2O0,McLane,B07CZCM4VZ,Cheerios General Mills Honey Nut Cheerios Gluten Free 306g,Cheerios General Mills Honey Nut ,,,,,,
KY2O0,McLane,B00D2PLAMW,"Gerber Blueberry Winter Puffs, 42 Gm","Gerber Blueberry Winter Puffs, 42",,,,,,
KY2O0,McLane,B0054K0R5Y,Gerber Organic Oatmeal Cereal 227g,Gerber Organic Oatmeal Cereal 227,,,,,,
KY2O0,McLane,B07CXJZVRR,Golden Grahams General Mills Cereal 331g,Golden Grahams General Mills Cere,,,,,,
KY2O0,McLane,B079HJZTX7,Gerber 2nd Foods Cereal Oatmeal peach apple Probiotic 8 oz.,Gerber 2nd Foods Cereal Oatmeal p,,,,,,
KY2O0,McLane,B07CX3GRXV,Cinnamon Toast Crunch General Mills 340g,Cinnamon Toast Crunch General Mil,,,,,,
KY2O0,McLane,B019Z95UCO,"Cheerios General Mills Cereal, 8.9 oz.","Cheerios General Mills Cereal, 8.",,,,,,
KY2O0,McLane,B000WGE26A,Gerber PUFFS Sweet Potato 42 G,Gerber PUFFS Sweet Potato 42 G,,,,,,
KY2O0,McLane,B00BLK5AKI,"Gerber 2Nd Foods Cereal Ngm, Multigrain 2","Gerber 2Nd Foods Cereal Ngm, Mult",,,,,,
KY2O0,McLane,B079HN2V2D,"Gerber 2Nd Food Cereal, Oat Banana Probiotic Bl 2","Gerber 2Nd Food Cereal, Oat Banan",,,,,,
KY2O0,McLane,B000WHS8M8,NestlÈ Gerber Crunchies Baked Corn Snack Mild Cheddar 42g,NestlÈ Gerber Crunchies Baked Cor,,,,,,
KY2O0,McLane,B003ZZABKG,Betty Crocker Fruit Rollups Strawberry Sensation 5 Oz,Betty Crocker Fruit Rollups Straw,,,,,,
KY2O0,McLane,B001OY2T1O,"Gerber Lil Biscuits, 126 gm","Gerber Lil Biscuits, 126 gm",,,,,,
KY2O0,McLane,B00XMYTY0S,"Fruit Roll-Ups Fruit Snacks, Blastin' Berry Hot Colors, 10 ct","Fruit Roll-Ups Fruit Snacks, Blas",,,,,,
KY2O0,McLane,B00CAUABOS,"Gerber Lil' Crunchies, Ranch","Gerber Lil' Crunchies, Ranch",,,,,,
KY2O0,McLane,B00JSCMGJ4,"Gerber Puffs Banana, 1.48 Oz.","Gerber Puffs Banana, 1.48 Oz.",,,,,,
KY2O0,McLane,B003XXD1O8,GERBER PUFFS APPLE CINNAMON 1.48oz,GERBER PUFFS APPLE CINNAMON 1.48o,,,,,,
KY2O0,McLane,B007TQG23C,"Betty Crocker Fruit Roll-Ups Fruit Flavored Snacks, Tropical Tie-Die, 0.5 oz, 10 ct",Betty Crocker Fruit Roll-Ups Frui,,,,,,
KY2O0,McLane,B002GK0570,"Gerber Lil' Crunchies, Garden Tomato, 1.48 Ounce (Pack of 1)","Gerber Lil' Crunchies, Garden Tom",,,,,,
KY2O0,McLane,B00CAUAAWG,"Gerber Snacks for Baby Lil Crunchies Apple Sweet Potato, 1.48 OZ",Gerber Snacks for Baby Lil Crunch,,,,,,
KY2O0,McLane,B07CZ83NQ4,General Mills Reese's Puffs Made With Peanut Butter 326g,General Mills Reese's Puffs Made ,,,,,,
KY2O0,McLane,B004PELWAY,"Gerber Lil' Crunchies, Veggie Dip, large","Gerber Lil' Crunchies, Veggie Dip",,,,,,
KY2O0,McLane,B0014CXH1C,"Nestle Coffee mate Gerber 1st Foods Cereal NGM, Oatmeal 2",Nestle Coffee mate Gerber 1st Foo,,,,,,
KY2O0,McLane,B000WGBLOQ,"Gerber Apple Harvest Teether Wheels, 42 g",Gerber Apple Harvest Teether Whee,,,,,,
KY2O0,McLane,B000PDHHDA,"Gerber Animal Crackers Pouch, 170 Gm","Gerber Animal Crackers Pouch, 170",,,,,,
KY2O0,McLane,B007F1MO42,"Cheerios General Mills Multi Grain Cheerios Cereal, 9 oz.",Cheerios General Mills Multi Grai,,,,,,
KY2O0,McLane,B00ECGW40C,"Martinelli's Apple Juice, 10 oz.","Martinelli's Apple Juice, 10 oz.",,,,,,
KY2O0,McLane,B08G8WV5T8,"Gerber Soft Baked Apple Cinnamon Grain Bars, 156 gm",Gerber Soft Baked Apple Cinnamon ,,,,,,
KY2O0,McLane,B000WGBLIC,"Gerber Banana Cookies, 142 gm","Gerber Banana Cookies, 142 gm",,,,,,
KY2O0,McLane,B07CX3FHMB,"Cinnamon Toast Crunch General Mills Cereal Ls, 16.8 oz.",Cinnamon Toast Crunch General Mil,,,,,,
KY2O0,McLane,B08V929N3B,"Martinelli's Sparkling Apple Grape, 8.4 oz",Martinelli's Sparkling Apple Grap,,,,,,
KY2O0,McLane,B09JWY9QSF,M.C. Trader Organic Apple Cider Vinegar 16Oz,M.C. Trader Organic Apple Cider V,,,,,,
KY2O0,McLane,B079HNF1WH,"Gerber toddler banana blueberry, 99 gm","Gerber toddler banana blueberry, ",,,,,,
KY2O0,McLane,B0BQYS999G,Cinnamon Toast Crunch GMI ROLLS 10.7 OZ,Cinnamon Toast Crunch GMI ROLLS 1,,,,,,
KY2O0,McLane,B001AS8QPC,"General Mills Trix Cereal, 10.7 Oz","General Mills Trix Cereal, 10.7 O",,,,,,
KY2O0,McLane,B07QCD9XR3,Betty Crocker Frt Rollups Jolly Ranchr 5 Oz,Betty Crocker Frt Rollups Jolly R,,,,,,
KY2O0,McLane,B07QDCR7PP,General Mills GMI FRENCH TOAST CRUNCH CEREAL MID 12/11.1 OZ,General Mills GMI FRENCH TOAST CR,,,,,,
KY2O0,McLane,B000R73XZ0,"Bragg Apple Cider Vinegar Organic, Raw, Unfiltered, 473 ml",Bragg Apple Cider Vinegar Organic,,,,,,
KY2O0,McLane,B000WLXMCU,Martinelli's Sparkling Apple Juice 10oz,Martinelli's Sparkling Apple Juic,,,,,,
KY2O0,McLane,B000WHXI0U,"Gerber Juice Apple Prune MP6, 4 fl oz.","Gerber Juice Apple Prune MP6, 4 f",,,,,,
KY2O0,McLane,B079HS4Z3S,"Gerber organic Toddler Banana Raspberry & Yogurt Vanilla, 99 gm",Gerber organic Toddler Banana Ras,,,,,,
KY2O0,McLane,B07QFH3BGS,"Cocoa Puffs General Mills Cereal Mid, 10.4 Oz.",Cocoa Puffs General Mills Cereal ,,,,,,
KY2O0,McLane,B00005C97M,"Gerber Apple Juice, 946 ml","Gerber Apple Juice, 946 ml",,,,,,
KY2O0,McLane,B0028UQ5VI,"Gerber Arrowroot Pouch Biscuits, 155 Gm","Gerber Arrowroot Pouch Biscuits, ",,,,,,
KY2O0,McLane,B002U5G3LS,"Dr Pepper Cherry Soda 12-Pack, 12 oz","Dr Pepper Cherry Soda 12-Pack, 12",,,,,,
KY2O0,McLane,B00J8U9EIM,WARHEADS HARD CANDY EXTREME SOUR 1oz (28g),WARHEADS HARD CANDY EXTREME SOUR ,,,,,,
KY2O0,McLane,B0083TG0CC,"Gerber 2Ndf Organic Pear Peach Strawberry, 99 Gm, large",Gerber 2Ndf Organic Pear Peach St,,,,,,
KY2O0,McLane,B007RYU6VA,Gerber Graduates Puffs Cereal Snack Vanilla,Gerber Graduates Puffs Cereal Sna,,,,,,
KY2O0,McLane,B0DJXK1XYX,Warheads Super Sour Assorted Fruit Flavor Tongue Roller Liquid Candy 25 ml,Warheads Super Sour Assorted Frui,,,,,,
KY2O0,McLane,B079HGYWRM,"Gerber Organic Apple Spinach with Kale, 4 oz, large",Gerber Organic Apple Spinach with,,,,,,
KY2O0,McLane,B079HNP18P,"Gerber Toddler Apple Pear Peach, 99 gm, large","Gerber Toddler Apple Pear Peach, ",,,,,,
KY2O0,McLane,B07RN6RQRL,"Gushers strawberry splash & tropical flavored, 4.8 oz, 6count",Gushers strawberry splash & tropi,,,,,,
KY2O0,McLane,B08DZKXDT8,Betty Crocker Pixar Assorted Fruit Flavored Snacks 10 ct-8oz,Betty Crocker Pixar Assorted Frui,,,,,,
KY2O0,McLane,B08H323F75,"M.C. Trader 100% Avocado Oil, 250 ml","M.C. Trader 100% Avocado Oil, 250",,,,,,
KY2O0,McLane,B00D2PKZ4Q,"Gerber 2nd Foods Organic, Carrot Apple Mango MP 2","Gerber 2nd Foods Organic, Carrot ",,,,,,
KY2O0,McLane,B08F745YDV,Betty Crocker Fruit By The Foot Starburst 4.5 Oz,Betty Crocker Fruit By The Foot S,,,,,,
KY2O0,McLane,B001BON63M,"Warheads Super Sour Spray Candy, Assorted Color/Flavor, 20 ml","Warheads Super Sour Spray Candy, ",,,,,,
KY2O0,McLane,B079HP47FS,"Gerber Toddler Apple Mango Strawberry, 99 gm, large",Gerber Toddler Apple Mango Strawb,,,,,,
KY2O0,McLane,B07CTGSPRT,Betty Crocker Fruit By The Tie Dye Variety Pack (Value Pack) 9 Oz,Betty Crocker Fruit By The Tie Dy,,,,,,
KY2O0,McLane,B079HN9RT2,"Gerber Organic Sweet Potato Apple Carrot & Cinnamon 4oz, large",Gerber Organic Sweet Potato Apple,,,,,,
KY2O0,McLane,B0BKN99SBV,Cinnamon Toast Crunch GMI MINIS MID 12/12.3 OZ,Cinnamon Toast Crunch GMI MINIS M,,,,,,
KY2O0,McLane,B07MFL7W8F,Gerber Teething Wafers For 7 Months Old - Pack Of 12 (2 Counts Each),Gerber Teething Wafers For 7 Mont,,,,,,
KY2O0,McLane,B00D2PKYWE,"Gerber 2nd Foods Organic, Apple Blueberry Spinach MP 2, large","Gerber 2nd Foods Organic, Apple B",,,,,,
