vendor_code,vendor_name,asin,item_name_raw,item_name_clean,brand,category,sub_category,pack_size,pack_unit,notes
SWM6A,Linkmax,B0949H3YZW,"Bazooka Rattlerz Sour Chewy Candies, 40g - Pack of 1",Bazooka Rattlerz Sour Chewy Candi,,,,,,
SWM6A,Linkmax,B087GJJZXQ,"Cagla Complex Finest Chocolate, 600 gm","Cagla Complex Finest Chocolate, 6",,,,,,
SWM6A,Linkmax,B0FQC7HSW1,BAZOOKA Push Pop Flip Lollipop - Cola/Raspberry/Strawberry (25g),BAZOOKA Push Pop Flip Lollipop - ,,,,,,
SWM6A,Linkmax,B0881M228T,"Pusan Princess Crispy Chocolate Coated, 320 gm",Pusan Princess Crispy Chocolate C,,,,,,
SWM6A,Linkmax,B017DO6EE6,"Guylian Les ExclUSives Belgian Chocolate, 305 Gm",Guylian Les ExclUSives Belgian Ch,,,,,,
SWM6A,Linkmax,B0893YFMXP,Ulker Tea Biscuit 70 gms,Ulker Tea Biscuit 70 gms,,,,,,
SWM6A,Linkmax,B087GM938Z,"Tian'S Pink & White Mallows, 500 Gm","Tian'S Pink & White Mallows, 500 ",,,,,,
SWM6A,Linkmax,B087GLVWX8,"Toren Delisso Hazelnut Flavour Wafer, 24 X 40 Gm",Toren Delisso Hazelnut Flavour Wa,,,,,,
SWM6A,Linkmax,B08R8QYDT8,"Bazooka Juicy Drop Extreme Sour Berry/Cherry 26 gms, Red, BSTW679655",Bazooka Juicy Drop Extreme Sour B,,,,,,
SWM6A,Linkmax,B087GJY7HW,"Palazi Danish Style Butter Cookies, 300 gm",Palazi Danish Style Butter Cookie,,,,,,
SWM6A,Linkmax,B0F8VZN86B,DEEMAH MINI BEAR CAKE 30 grams (pack of 12),DEEMAH MINI BEAR CAKE 30 grams (p,,,,,,
SWM6A,Linkmax,B09C7ZD795,Bahar Laundry Detergent Powder 625 gm,Bahar Laundry Detergent Powder 62,,,,,,
SWM6A,Linkmax,B0BB3H5CF6,Candyland Mini Chocolate Chip 16 g,Candyland Mini Chocolate Chip 16 ,,,,,,
SWM6A,Linkmax,B07W5KJJL4,"Torku Banada Cocoa & Hazelnut Spread Cream, 400 gm",Torku Banada Cocoa & Hazelnut Spr,,,,,,
SWM6A,Linkmax,B087GMQPQ5,"Arcor Bon O Bon Surtido Chocolate, 1 kg",Arcor Bon O Bon Surtido Chocolate,,,,,,
SWM6A,Linkmax,B08LNPRZYP,Ulker Biskrem Cocoa Cream Filled Cookies 36 gms,Ulker Biskrem Cocoa Cream Filled ,,,,,,
SWM6A,Linkmax,B00PCL699S,Ulker Petit Beurre Biscuits 175 gms,Ulker Petit Beurre Biscuits 175 g,,,,,,
SWM6A,Linkmax,B0FDPNPYHK,Little Freddie Organic Mango and Pumpkin Rice Teethers - 6+ Months Baby Food & Snacks,Little Freddie Organic Mango and ,,,,,,
SWM6A,Linkmax,B0B5V5FXTH,"Cloetta chewits xtreme sour apple and lemon candy, multicolor",Cloetta chewits xtreme sour apple,,,,,,
SWM6A,Linkmax,B0881M9ZHF,"Cihan Hazelnut Cream Chocolate, 2 kg","Cihan Hazelnut Cream Chocolate, 2",,,,,,
SWM6A,Linkmax,B0C9D8GGKL,"Little Freddie Organic Italian Cherry Tomato Grains, 140g, 1-4 years",Little Freddie Organic Italian Ch,,,,,,
SWM6A,Linkmax,B00H05PMGA,Ulker Chocosandwich Cream Biscuits 73 gms,Ulker Chocosandwich Cream Biscuit,,,,,,
SWM6A,Linkmax,B00HQTSJQK,"Cagla Complex Mixed Chocolate Box, 820 gm",Cagla Complex Mixed Chocolate Box,,,,,,
SWM6A,Linkmax,B0B94LM58Q,Zeeba Classic Basmati Rice 5kg,Zeeba Classic Basmati Rice 5kg,,,,,,
SWM6A,Linkmax,B01MQXFFFA,Solen 5910 Luppo Cakebite Chocolate 12-Pieces 184 g,Solen 5910 Luppo Cakebite Chocola,,,,,,
SWM6A,Linkmax,B087GLW2B8,"Americandy Big Bom XL Mango Lollipops, 16 Gm (Pack Of 48)",Americandy Big Bom XL Mango Lolli,,,,,,
SWM6A,Linkmax,B07NF7MP99,Ulker Tea Biscuit - 160gm,Ulker Tea Biscuit - 160gm,,,,,,
SWM6A,Linkmax,B087C6VWJZ,"Little Freddie Organic Carrot & Chickpeas with Pumpkin Seed Butter, 120g, 6+ months",Little Freddie Organic Carrot & C,,,,,,
SWM6A,Linkmax,B0943X7L1V,Solen 3601/3540 Ozmo Chocolate Egg with Toys 20 g,Solen 3601/3540 Ozmo Chocolate Eg,,,,,,
SWM6A,Linkmax,B0DFVG5Z29,Ulker Biskrem Cookie with Cardamom Flavored Cocoa Cream 36 gms (pack of 12),Ulker Biskrem Cookie with Cardamo,,,,,,
SWM6A,Linkmax,B087GKF126,"Cagla Camellia Chocolate, 25 Gm (Pack Of 24)","Cagla Camellia Chocolate, 25 Gm (",,,,,,
SWM6A,Linkmax,B0948B4LTZ,Shield Strong Aluminum Foil 25 Sqft,Shield Strong Aluminum Foil 25 Sq,,,,,,
SWM6A,Linkmax,B0881M8KCS,"Elvan Truffle Coffee Cream Chocolate, 2 Kg",Elvan Truffle Coffee Cream Chocol,,,,,,
SWM6A,Linkmax,B0B22JNWTW,Ulker Tea Biscuit with Cacao 70 gms,Ulker Tea Biscuit with Cacao 70 g,,,,,,
SWM6A,Linkmax,B07ZJQN1KL,"Colombina Bbb Assorted Bubble Gum, 1.7 kg",Colombina Bbb Assorted Bubble Gum,,,,,,
SWM6A,Linkmax,B07NF72GSR,Topps Juicy Drop Pop Candy 26g,Topps Juicy Drop Pop Candy 26g,,,,,,
SWM6A,Linkmax,B0881M8GQ4,"Occa Pello Cherry Jelly Filled Compound Chocolate, 2 kg",Occa Pello Cherry Jelly Filled Co,,,,,,
SWM6A,Linkmax,B0BKDX7KHF,"Little Freddie Organic Creamy Butternut Squash Risotto, 130g, 7+ months",Little Freddie Organic Creamy But,,,,,,
SWM6A,Linkmax,B0FDQ4J51R,Little Freddie Organic Raspberry & Apple Rice Teethers - 6+ Months Baby Food & Snacks,Little Freddie Organic Raspberry ,,,,,,
SWM6A,Linkmax,B0881MFXZJ,"Cihan Mustang Yellow Turffle Chocolate, 2 kg",Cihan Mustang Yellow Turffle Choc,,,,,,
SWM6A,Linkmax,B09BVT2CS7,CHEWITS XTREME CHERRY STICK,CHEWITS XTREME CHERRY STICK,,,,,,
SWM6A,Linkmax,B087GMV3WL,"Arcor Butter Leche and Milk Toffees, 6.3 gm",Arcor Butter Leche and Milk Toffe,,,,,,
SWM6A,Linkmax,B0BN1TQT5C,No data available,No data available,,,,,,
SWM6A,Linkmax,B0C9DC1D2Z,"Little Freddie Organic Exotic Coconut & Tropical Fruits Puree, 100g, 6+ months",Little Freddie Organic Exotic Coc,,,,,,
SWM6A,Linkmax,B0CB7X5CTC,Bisconni Mini Chocolate Chip Cookies,Bisconni Mini Chocolate Chip Cook,,,,,,
SWM6A,Linkmax,B09C8D6RZ2,Bahar Professional Low Foam Detergent Powder 25 kg,Bahar Professional Low Foam Deter,,,,,,
SWM6A,Linkmax,B0881N34S1,"Palazi Oat Choco, 10 gm (Pack of 32)","Palazi Oat Choco, 10 gm (Pack of ",,,,,,
SWM6A,Linkmax,B0968KMKXJ,"Solen Vip Cocoa Coated, 24 X 40 Gm","Solen Vip Cocoa Coated, 24 X 40 G",,,,,,
SWM6A,Linkmax,B0881MC77L,"Occa Pello Red Chocolate Turffle, 2 kg","Occa Pello Red Chocolate Turffle,",,,,,,
SWM6A,Linkmax,B084ZTYXWF,Solen 1207 Luppo Cakebite Chocolate 12-Pieces 300 g,Solen 1207 Luppo Cakebite Chocola,,,,,,
SWM6A,Linkmax,B0881MNC3F,"Cihan Mustang Blue Turffle Chocolate, 2 kg",Cihan Mustang Blue Turffle Chocol,,,,,,
SWM6A,Linkmax,B087GM3THW,"Fondante Elvan CaRAMel Chocolate Cream Fudge, 500 gm",Fondante Elvan CaRAMel Chocolate ,,,,,,
SWM6A,Linkmax,B079JJ2VLS,"Bazooka Candy Brands Tutti Frutti Flavour Soft Chew Bar, 14 g (Pack of 60)",Bazooka Candy Brands Tutti Frutti,,,,,,
SWM6A,Linkmax,B0881MS9C3,"Mybizcuit Choco Peanut Crunchy Bar, 100 gm",Mybizcuit Choco Peanut Crunchy Ba,,,,,,
SWM6A,Linkmax,B0FQC3V275,BAZOOKA Juicy Drop Pop Lollipop (26g) - Strawberry,BAZOOKA Juicy Drop Pop Lollipop (,,,,,,
SWM6A,Linkmax,B08YXZZKBT,"Ozmo Solen Hoppo Biscuits With Choco Cream, 90 gm",Ozmo Solen Hoppo Biscuits With Ch,,,,,,
SWM6A,Linkmax,B07MKS27T6,Whittaker's 395 76% Cocoa Nicargua Rich Dark Chocolate 100 g,Whittaker's 395 76% Cocoa Nicargu,,,,,,
SWM6A,Linkmax,B087GJGZS6,"Jouy & Co Jouy & Co Jouy & Co Chiqola Cocoa Cream Pralines, 120 gm",Jouy & Co Jouy & Co Jouy & Co Chi,,,,,,
SWM6A,Linkmax,B078T3BTCR,"Morris Royal Cheese Cracker Biscuit, 120 Gm",Morris Royal Cheese Cracker Biscu,,,,,,
SWM6A,Linkmax,B0CPPMGLNJ,Ulker Chocosandwich Bites Cream Biscuits 32 gms (pack of 12),Ulker Chocosandwich Bites Cream B,,,,,,
SWM6A,Linkmax,B087GJ1CTR,"Cagla Party Mix Assorted Chocolate Bars, 450 gm",Cagla Party Mix Assorted Chocolat,,,,,,
SWM6A,Linkmax,B087GJPT4H,"Danpak Egg Shaped Chocolate, 6.2 gm (Pack of 60)","Danpak Egg Shaped Chocolate, 6.2 ",,,,,,
SWM6A,Linkmax,B07PZKNWCB,"Bahar Abaya Fabric Softener Care 1 Litre, Black",Bahar Abaya Fabric Softener Care ,,,,,,
SWM6A,Linkmax,B0BN5GM83X,"Bazooka Mix Upz Sweet Candy 120 g, 12-Pack",Bazooka Mix Upz Sweet Candy 120 g,,,,,,
SWM6A,Linkmax,B0B9MWJ722,Solen 4024 Ozmo Club Milk Chocolate 44 g 20 pieces Multicolor,Solen 4024 Ozmo Club Milk Chocola,,,,,,
SWM6A,Linkmax,B0881MNVBF,"Occa Pello Hazelnut Cream Filled Chocolate, 2 kg",Occa Pello Hazelnut Cream Filled ,,,,,,
SWM6A,Linkmax,B0F9YWTKFT,Ulker Biskrem Cookie with Tiramisu Flavored Cocoa Cream 36 gms,Ulker Biskrem Cookie with Tiramis,,,,,,
SWM6A,Linkmax,B0881MCM6L,"Morris Luxy Chocolate Cream Sandwich Cracker, 190 gm",Morris Luxy Chocolate Cream Sandw,,,,,,
SWM6A,Linkmax,B07H8CRJVG,"Elvan Milky Fondante Carmel Chocolate, 1 Kg",Elvan Milky Fondante Carmel Choco,,,,,,
SWM6A,Linkmax,B0881M9664,"Al Douri Blend with Cardamom Coffee, 100 gm (Pack of 10)",Al Douri Blend with Cardamom Coff,,,,,,
SWM6A,Linkmax,B087GJGZR6,"Yixin Umbrella Shape Lollipop, 17 gm (Pack Of 50)","Yixin Umbrella Shape Lollipop, 17",,,,,,
SWM6A,Linkmax,B0881MBP2M,"Cihan Mustang Green Turffle Chocolate, 2 kg",Cihan Mustang Green Turffle Choco,,,,,,
SWM6A,Linkmax,B006J3HSFM,Julies Oat 25 Ten Grains 200G,Julies Oat 25 Ten Grains 200G,,,,,,
SWM6A,Linkmax,B079JLHDGC,Bazooka Candy Brands Push Pop Strawberry / Blackcurrant Lollipop -15 Gm (Pack Of 20),Bazooka Candy Brands Push Pop Str,,,,,,
SWM6A,Linkmax,B0827CND45,No data available,No data available,,,,,,
SWM6A,Linkmax,B087GMFV2M,"Erko Flat Bag Ice-Cream Flavour Marshmallows, 140 gm",Erko Flat Bag Ice-Cream Flavour M,,,,,,
SWM6A,Linkmax,B01L77BPSU,Hectare's Salted Caramel Popcorn 25 g,Hectare's Salted Caramel Popcorn ,,,,,,
SWM6A,Linkmax,B078T3MXZV,"Morris Cocoa Chips Butter Crunch Cookies, 120 Gm",Morris Cocoa Chips Butter Crunch ,,,,,,
SWM6A,Linkmax,B0881MCM6G,"Elvan Cocos Bag Coconut Bar, 500 Gm","Elvan Cocos Bag Coconut Bar, 500 ",,,,,,
SWM6A,Linkmax,B0FDLC8F8X,No data available,No data available,,,,,,
SWM6A,Linkmax,B0CPPKNRHK,Ulker Chocosandwich Bites Dark Vanilla Cream Biscuits 32 gms (pack of 12),Ulker Chocosandwich Bites Dark Va,,,,,,
SWM6A,Linkmax,B0847NP1SZ,"Solen Amada Chocolove Roll Hazelnut, 25.5 gm",Solen Amada Chocolove Roll Hazeln,,,,,,
SWM6A,Linkmax,B0881MJYM5,"Fondante Elvan Carmel Chocolate, 1 Kg","Fondante Elvan Carmel Chocolate, ",,,,,,
SWM6A,Linkmax,B0FDLBDRLJ,No data available,No data available,,,,,,
SWM6A,Linkmax,B0881MC1TB,"Occa Pello Caramel Jelly Filled Compound Chocolate, 2 kg",Occa Pello Caramel Jelly Filled C,,,,,,
SWM6A,Linkmax,B08M7F67RS,Little Freddy Organic Milk Biscuits - 12+ Months Baby Food & Snacks,Little Freddy Organic Milk Biscui,,,,,,
SWM6A,Linkmax,B0881M9VBF,"Zpc MilanÛwek Assorted Cream Fudge, 775 gm",Zpc MilanÛwek Assorted Cream Fudg,,,,,,
SWM6A,Linkmax,B07M6HMS9S,Ulker Chocosandwich Cream Biscuits 23.5 gms,Ulker Chocosandwich Cream Biscuit,,,,,,
SWM6A,Linkmax,B0CFV5T778,La Molisana Con Spinaci 500 Gms,La Molisana Con Spinaci 500 Gms,,,,,,
SWM6A,Linkmax,B08Z4BR33J,"Solen Milango Diamond, 12 X 38 Gm","Solen Milango Diamond, 12 X 38 Gm",,,,,,
SWM6A,Linkmax,B0881MBP29,"Cici Gusto Dark Cocoa Wafer with Bitter Cream, 50 gm (Pack of 24)",Cici Gusto Dark Cocoa Wafer with ,,,,,,
SWM6A,Linkmax,B01A7XR9F8,TAKIS FUEGO 113G,TAKIS FUEGO 113G,,,,,,
SWM6A,Linkmax,B087GNLVZQ,"Elvan Extra Strawberry Flavour Chocolate, 2 kg",Elvan Extra Strawberry Flavour Ch,,,,,,
WJTPX,WJTowell,B07MV32JLH,"Afia Corn Oil, 9 Ltr","Afia Corn Oil, 9 Ltr",,,,,,
WJTPX,WJTowell,B07NF7MFKX,Tetley Strong Black Tea | 200 Black Tea Bags | More Tea per Bag for a Fuller Flavour | Foil Sealed Freshness | 440g,Tetley Strong Black Tea | 200 Bla,,,,,,
WJTPX,WJTowell,B015J4YNNG,"Tetley Black Tea, Decaf, 80 Round Tea Bags","Tetley Black Tea, Decaf, 80 Round",,,,,,
WJTPX,WJTowell,B07NF7MR14,Tetley Strong Black Tea | 100 Black Tea Bags | More Tea per Bag for a Fuller Flavour | Foil Sealed Freshness | 220g (Packaging May Vary),Tetley Strong Black Tea | 100 Bla,,,,,,
WJTPX,WJTowell,B005LLZ3QY,Tetley 1 X Tea Bags Decaffeinated 80 250g,Tetley 1 X Tea Bags Decaffeinated,,,,,,
WJTPX,WJTowell,B07P6YJPPG,Afia Sunflower Oil 9Litre,Afia Sunflower Oil 9Litre,,,,,,
WJTPX,WJTowell,B08C1BXXXV,"O'lite Pure Canola Oil, 1.5 L","O'lite Pure Canola Oil, 1.5 L",,,,,,
WJTPX,WJTowell,B07P75SDV2,Al Osra Fine Sugar - 5 Kilogram,Al Osra Fine Sugar - 5 Kilogram,,,,,,
WJTPX,WJTowell,B0711KYX2S,Lotte Pepero Almond Value Pack ñ 8 x 32g ñ Crunchy Biscuit Sticks with Chocolate & Almonds,Lotte Pepero Almond Value Pack ñ ,,,,,,
WJTPX,WJTowell,B083VKDQ3P,"Tata Tea Masala Chai, Loose Black Tea, with Masala Spices, 200g, Packet","Tata Tea Masala Chai, Loose Black",,,,,,
WJTPX,WJTowell,B088FH4VG8,CHINGS SCHEZWAN CHUTNEY 1Kg,CHINGS SCHEZWAN CHUTNEY 1Kg,,,,,,
WJTPX,WJTowell,B0D2P6KRB1,Tata Soulfull 90% Whole Grains Fruit and Nut Millet Muesli,Tata Soulfull 90% Whole Grains Fr,,,,,,
WJTPX,WJTowell,B0DT61H872,TATA SOULFULL MUESLI 0% ADDED SUGAR 500g,TATA SOULFULL MUESLI 0% ADDED SUG,,,,,,
WJTPX,WJTowell,B08GD1Z9PS,"Tetley Black Tea, Original, 160 Round Tea Bags","Tetley Black Tea, Original, 160 R",,,,,,
WJTPX,WJTowell,B00Y09JC24,CHINGS SCHEZWAN CHUTNEY 250g,CHINGS SCHEZWAN CHUTNEY 250g,,,,,,
WJTPX,WJTowell,B07PKCQ275,Afia Extra Virgin Olive Oil 250ml,Afia Extra Virgin Olive Oil 250ml,,,,,,
WJTPX,WJTowell,B083VKML26,Tetley Gold Loose Black Tea 400g,Tetley Gold Loose Black Tea 400g,,,,,,
WJTPX,WJTowell,B083VKDMN1,Tata Tea Premium | Unique Blend Crafted For Chai Lovers | Loose Black Tea | 1.8kg | Pouch,Tata Tea Premium | Unique Blend C,,,,,,
WJTPX,WJTowell,B0749NNYF5,"Ching's Secret Red Chilli Sauce, 680 gm","Ching's Secret Red Chilli Sauce, ",,,,,,
WJTPX,WJTowell,B0847NQFB6,"Al Osra Natural Brown Sugar, 500 gm","Al Osra Natural Brown Sugar, 500 ",,,,,,
WJTPX,WJTowell,B01C4L6IIK,"Lotte Pepero White Chocolate Cookie Biscuit Stick, 128 G",Lotte Pepero White Chocolate Cook,,,,,,
WJTPX,WJTowell,B01LYT8NCG,"foster clark's Clark Bicarbonate Of Soda, 150 G",foster clark's Clark Bicarbonate ,,,,,,
WJTPX,WJTowell,B009B1L17K,Al Osra Fine Sugar 1kg,Al Osra Fine Sugar 1kg,,,,,,
WJTPX,WJTowell,B0792L8SY6,Lotte Pepero Almond Chocolate & Biscuit (128g),Lotte Pepero Almond Chocolate & B,,,,,,
WJTPX,WJTowell,B00LQO3FUQ,"Tata Vacuum Evaporated Iodised Salt, 1 kg",Tata Vacuum Evaporated Iodised Sa,,,,,,
WJTPX,WJTowell,B083VKPXST,AL RIFAI MIXED NUTS 500g,AL RIFAI MIXED NUTS 500g,,,,,,
WJTPX,WJTowell,B0735DQN34,"Ching's Secret Ching's, Secret Dark Soy Sauce, 750 grams","Ching's Secret Ching's, Secret Da",,,,,,
WJTPX,WJTowell,B0D2P5HXT1,Tata Soulfull 80% Whole Grains Crunchy Almonds and Raisins Millet Muesli,Tata Soulfull 80% Whole Grains Cr,,,,,,
WJTPX,WJTowell,B083VKRTPS,Tata Tea Premium Unique Blend Crafted For Chai Lovers Loose Black Tea 400g Packet,Tata Tea Premium Unique Blend Cra,,,,,,
WJTPX,WJTowell,B07PCF1NF9,Al Osra Fine Sugar 2kg,Al Osra Fine Sugar 2kg,,,,,,
WJTPX,WJTowell,B07NF85QWR,"Al Rifai Assorted Mixed Nuts, 500g","Al Rifai Assorted Mixed Nuts, 500",,,,,,
WJTPX,WJTowell,B07576C6TY,CHINGS SCHEZWAN SAUCE 250g,CHINGS SCHEZWAN SAUCE 250g,,,,,,
WJTPX,WJTowell,B083VKVWG6,"Al Rifai cashew with cheese, 160g","Al Rifai cashew with cheese, 160g",,,,,,
WJTPX,WJTowell,B083VK9J3B,"Al Rifai Smoked Sunflower Seeds, 125g","Al Rifai Smoked Sunflower Seeds, ",,,,,,
WJTPX,WJTowell,B083VK2HQH,Tetley Gold Loose Black Tea 15% Long Leaf 200g Packet,Tetley Gold Loose Black Tea 15% L,,,,,,
WJTPX,WJTowell,B07NF78ZBY,Tetley Pure Green Tea |100 Green Tea Bags | Specially Blended for a Smoother Taste| Foil Sealed Freshness | 150 g,Tetley Pure Green Tea |100 Green ,,,,,,
WJTPX,WJTowell,B09CWX9NDP,CHINGS DARK SOY SAUCE 750g,CHINGS DARK SOY SAUCE 750g,,,,,,
WJTPX,WJTowell,B083VL85MX,Tata Tea | Kanan Devan Classic | Loose Black Tea | Blended By Experts | 1.8kg | Pouch,Tata Tea | Kanan Devan Classic | ,,,,,,
WJTPX,WJTowell,B079H9C6R5,CHINGS TOMATO SOUP 55g,CHINGS TOMATO SOUP 55g,,,,,,
WJTPX,WJTowell,B01JAY1OWY,CHINGS DARK SOY SAUCE 210g,CHINGS DARK SOY SAUCE 210g,,,,,,
WJTPX,WJTowell,B01E5RZPPI,foster clark's Baking Powder 225g,foster clark's Baking Powder 225g,,,,,,
WJTPX,WJTowell,B083VKVVK9,AL RIFAI UNSALTED COCKTAIL MIX 200g,AL RIFAI UNSALTED COCKTAIL MIX 20,,,,,,
WJTPX,WJTowell,B083VKGY29,Tata Tea Cardamom Chai | Loose Black Tea | With Natural Cardamom Flavour | 200g | Packet,Tata Tea Cardamom Chai | Loose Bl,,,,,,
WJTPX,WJTowell,B0C62CMRMF,"Tata Coffee Gold, 100% Pure Coffee, Original, Freeze dried granules, Instant Coffee, Crafted from Specially Sourced Beans, 95g,Jar","Tata Coffee Gold, 100% Pure Coffe",,,,,,
WJTPX,WJTowell,B083VKPXV2,"Sultan Coconut Milk Powder, 1 kg","Sultan Coconut Milk Powder, 1 kg",,,,,,
WJTPX,WJTowell,B08C1BXHZT,"Sun Vita Cooking & Frying Oil, 1.5 Litre","Sun Vita Cooking & Frying Oil, 1.",,,,,,
WJTPX,WJTowell,B079H7X84W,"Ching'S Secret Egg Hakka Noodles, 150 Gm","Ching'S Secret Egg Hakka Noodles,",,,,,,
WJTPX,WJTowell,B01FMA8PRW,Foster Clark's Custard Powder - 300 gm,Foster Clark's Custard Powder - 3,,,,,,
WJTPX,WJTowell,B07N1QW1L4,"SPLENDA Stevia Zero Calorie Sweetener, Plant Based Sugar Substitute Tablets, 80 Count",SPLENDA Stevia Zero Calorie Sweet,,,,,,
WJTPX,WJTowell,B083VK2HW5,RIFAI SPICY MIX 170gms,RIFAI SPICY MIX 170gms,,,,,,
WJTPX,WJTowell,B0756YP6QK,"Ching's Secret Veg Manchurian Masala, 50 gm",Ching's Secret Veg Manchurian Mas,,,,,,
WJTPX,WJTowell,B07NF7G74H,"Al Arabi Pure Vegetable Oil, 1.5 Litre","Al Arabi Pure Vegetable Oil, 1.5 ",,,,,,
WJTPX,WJTowell,B07MQ16Q5L,Lotte Pepero White Chocolate 32g,Lotte Pepero White Chocolate 32g,,,,,,
WJTPX,WJTowell,B0DDCPPZK1,Ching's Secret Chicken 65 Masala 50 g,Ching's Secret Chicken 65 Masala ,,,,,,
WJTPX,WJTowell,B08C192WMP,"Al Arabi Pure Vegetable Oil, 2.9 Litre","Al Arabi Pure Vegetable Oil, 2.9 ",,,,,,
WJTPX,WJTowell,B07NF8C4JJ,AL RIFAI PUMPKIN SEEDS 140g,AL RIFAI PUMPKIN SEEDS 140g,,,,,,
WJTPX,WJTowell,B004TRNK20,Lotte Pepero Choco Filled Chocolate And Biscuit 50g,Lotte Pepero Choco Filled Chocola,,,,,,
WJTPX,WJTowell,B075733JRQ,CHINGíS VEG HAKKA NDLS 140g,CHINGíS VEG HAKKA NDLS 140g,,,,,,
WJTPX,WJTowell,B001QBX8BU,Tetley Original Black Tea Bags -125 gm - Assorted prints,Tetley Original Black Tea Bags -1,,,,,,
WJTPX,WJTowell,B08296B566,"Ching's Secret Schezwan Fried Rice Masala, 5 x 20 gm",Ching's Secret Schezwan Fried Ric,,,,,,
WJTPX,WJTowell,B0CYT7YKYH,Tetley English Breakfasttea 50's,Tetley English Breakfasttea 50's,,,,,,
WJTPX,WJTowell,B083VK8HZK,Tetley Strong Loose Black Tea 200g Packet,Tetley Strong Loose Black Tea 200,,,,,,
WJTPX,WJTowell,B07NF825YZ,AL RIFAI ALMONDS COCKTAIL 200g,AL RIFAI ALMONDS COCKTAIL 200g,,,,,,
WJTPX,WJTowell,B00FHD9Y5W,Ching's Secret Veg Hakka Noodles 560gm,Ching's Secret Veg Hakka Noodles ,,,,,,
WJTPX,WJTowell,B01N0AHJ3U,"Splenda Granulated Ceka Can, 75 Gm","Splenda Granulated Ceka Can, 75 G",,,,,,
WJTPX,WJTowell,B00A3KSCXY,"Al Rifai Almond Smoked, 200g","Al Rifai Almond Smoked, 200g",,,,,,
WJTPX,WJTowell,B083VK72KB,Tata Tea Premium Unique Blend Crafted For Chai Lovers Loose Black Tea 800g Packet,Tata Tea Premium Unique Blend Cra,,,,,,
WJTPX,WJTowell,B083VKYVF4,"Foster Clarks Whipped Topping Mix, 144 G",Foster Clarks Whipped Topping Mix,,,,,,
WJTPX,WJTowell,B00GB8Y30S,CHINGS GREEN CHILLI SAUCE 680g,CHINGS GREEN CHILLI SAUCE 680g,,,,,,
WJTPX,WJTowell,B07531B6QM,"Ching's Secret Red Chilli Sauce, 200 gm","Ching's Secret Red Chilli Sauce, ",,,,,,
WJTPX,WJTowell,B0DDCMJ6TT,Chings Manchurian Stir Fry Cooking Sauce 250 g,Chings Manchurian Stir Fry Cookin,,,,,,
WJTPX,WJTowell,B083VL3R3L,Tetley Strong Loose Black Tea 400g Packet,Tetley Strong Loose Black Tea 400,,,,,,
WJTPX,WJTowell,B0C8BBWN4X,CHINGS SCHEZWAN CHUTNEY 500g+90g EXTRA,CHINGS SCHEZWAN CHUTNEY 500g+90g ,,,,,,
WJTPX,WJTowell,B00OD85QW2,Lotte Pepero Original Chocolate Biscuit Sticks 1.66 Oz (Pack of 10),Lotte Pepero Original Chocolate B,,,,,,
WJTPX,WJTowell,B079H3CX14,CHINGS SCHEZWAN FRIED RICE MASALA 50g,CHINGS SCHEZWAN FRIED RICE MASALA,,,,,,
WJTPX,WJTowell,B083VK1X8N,Tata Tea Premium Unique Blend Crafted For Chai Lovers Loose Black Tea 400g Jar,Tata Tea Premium Unique Blend Cra,,,,,,
WJTPX,WJTowell,B083VKNDBM,"foster clark's Dark Chocolate Cake Mix, 500 G",foster clark's Dark Chocolate Cak,,,,,,
WJTPX,WJTowell,B075RYJS3F,CHINGS SCHEZWAN NOODLES 60g,CHINGS SCHEZWAN NOODLES 60g,,,,,,
WJTPX,WJTowell,B0D2P44PQ9,Tata Soulfull Yummy Chocolate Crunchy Chocos Ragi Bites Breakfast Cereals 350 g,Tata Soulfull Yummy Chocolate Cru,,,,,,
WJTPX,WJTowell,B0CYT9BCRH,Tata Coffee Grand Premium Instant Coffee | 100% Coffee Blend | With Flavour Locked Decoction Crystals |48g Jar,Tata Coffee Grand Premium Instant,,,,,,
WJTPX,WJTowell,B0B8GMD5W2,Kanan Devan Tea Dust Jar 400g,Kanan Devan Tea Dust Jar 400g,,,,,,
WJTPX,WJTowell,B07575VD7D,CHINGS HOT & SOUR VEGETABLE SOUP 55g,CHINGS HOT & SOUR VEGETABLE SOUP ,,,,,,
WJTPX,WJTowell,B08WXSNHL3,CHINGS PANEER CHILLI MASALA MIX 50g,CHINGS PANEER CHILLI MASALA MIX 5,,,,,,
WJTPX,WJTowell,B07NF8WZRC,KANCHO CHOCO 34gm,KANCHO CHOCO 34gm,,,,,,
WJTPX,WJTowell,B07575JWZV,Ching's Secret Hot Garlic Instant Noodles 240g,Ching's Secret Hot Garlic Instant,,,,,,
WJTPX,WJTowell,B07576775Y,"Ching's Secret Manchurian Noodles, 60 gm",Ching's Secret Manchurian Noodles,,,,,,
WJTPX,WJTowell,B07575J55Z,"Ching's Secret Chilli Vinegar, 170 Ml","Ching's Secret Chilli Vinegar, 17",,,,,,
WJTPX,WJTowell,B06XFDSL4K,Ching's Secret SWEET CORN VEGETABLE SOUP 55g,Ching's Secret SWEET CORN VEGETAB,,,,,,
WJTPX,WJTowell,B07576B8PN,"Ching's Secret Hot Garlic Noodles, 60 Gm",Ching's Secret Hot Garlic Noodles,,,,,,
WJTPX,WJTowell,B0FLJH5G4D,Diamond Saffron Powder 24 x.2g Each Premium Quality Ideal for Daily Use,Diamond Saffron Powder 24 x.2g Ea,,,,,,
WJTPX,WJTowell,B083VK35V2,"Diamond Orange Marmalade Natural Jam, 454 g",Diamond Orange Marmalade Natural ,,,,,,
WJTPX,WJTowell,B00JOQS7FQ,"Al Rifai Salted Cashews Nuts, 200g","Al Rifai Salted Cashews Nuts, 200",,,,,,
WJTPX,WJTowell,B083VKCZ15,Afia Extra Virgin Olive Oil 500ml,Afia Extra Virgin Olive Oil 500ml,,,,,,
WJTPX,WJTowell,B083VKVVDL,"Diamond Pineapple Natural Jam, 454 g","Diamond Pineapple Natural Jam, 45",,,,,,
WJTPX,WJTowell,B079GXSQC4,CHINGS MANCHOW SOUP 55g,CHINGS MANCHOW SOUP 55g,,,,,,
WJTPX,WJTowell,B0BX71DBTN,CHINGS DRAGON FIRE CHUTNEY 250g,CHINGS DRAGON FIRE CHUTNEY 250g,,,,,,
WJTPX,WJTowell,B072BZJJN7,"SPLENDA Stevia Zero Calorie Sweetener, Plant Based Sugar Substitute Granulated Powder, Single Serve Packets, 40 Count",SPLENDA Stevia Zero Calorie Sweet,,,,,,
WJTPX,WJTowell,B071NV5JK8,"Lotte Pepero White Chocolate, 256 g","Lotte Pepero White Chocolate, 256",,,,,,
WJTPX,WJTowell,B07NF7X3PH,AL RIFAI PEANUTS NACHOS 150g,AL RIFAI PEANUTS NACHOS 150g,,,,,,
WJTPX,WJTowell,B00345SZ00,CHINGS SCHEZWAN NOODLES 240g,CHINGS SCHEZWAN NOODLES 240g,,,,,,
WJTPX,WJTowell,B07NF7QH9S,"Al Rifai Mixed Nuts & Kernels, 200g","Al Rifai Mixed Nuts & Kernels, 20",,,,,,
WJTPX,WJTowell,B0BF7B1H1G,DIAMOND ??????? Coconut Milk 330ml -Tetra Pack,DIAMOND ??????? Coconut Milk 330m,,,,,,
WJTPX,WJTowell,B00A0BDB4G,"American Garden Veg Sliced Beets, 425 g","American Garden Veg Sliced Beets,",,,,,,
WJTPX,WJTowell,B07NF7KMMK,AL RIFAI MIXED NUTS ASSORTED 200g,AL RIFAI MIXED NUTS ASSORTED 200g,,,,,,
WJTPX,WJTowell,B083VKCLGR,Tetley Strong Black Tea 50 Black Tea Bags More Tea per Bag for a Fuller Flavour Foil Sealed Freshness 100g,Tetley Strong Black Tea 50 Black ,,,,,,
WJTPX,WJTowell,B083VKND7T,Tata Tea Premium Unique Blend Crafted For Chai Lovers Loose Black Tea 800g Jar,Tata Tea Premium Unique Blend Cra,,,,,,
WJTPX,WJTowell,B083VKYQTG,AL RIFAI COCKTAIL MIX NUTS 500g,AL RIFAI COCKTAIL MIX NUTS 500g,,,,,,
WJTPX,WJTowell,B01M4IDUTR,CHINGíS VEG HAKKA NDLS 140g,CHINGíS VEG HAKKA NDLS 140g,,,,,,
WJTPX,WJTowell,B0DKF4ZJDN,Afia Sun Vita Blended Vegetable Oil 2.9 Liter,Afia Sun Vita Blended Vegetable O,,,,,,
WJTPX,WJTowell,B00L28D0QU,"American Garden Microwave Natural Popcorn, Gluten-Free, 273g (3 Bags of 91g)",American Garden Microwave Natural,,,,,,
WJTPX,WJTowell,B087GK61LY,"Diamond Royal Jelly In Flower Honey, 250 gm",Diamond Royal Jelly In Flower Hon,,,,,,
WJTPX,WJTowell,B083VKML59,"American Garden Ameriacn N Mushroom Pieces & Stems, 425g",American Garden Ameriacn N Mushro,,,,,,
WJTPX,WJTowell,B006OHBYTY,"American Garden Thousand Island Dressing & Dip, Gluten-Free, Dairy-Free, 267ml",American Garden Thousand Island D,,,,,,
WJTPX,WJTowell,B084CLC4YB,rusepin Tata Coffee Grand | Filter Coffee | Roasted & Grounded | Coffee & Chicory Mix | 500g | Pouch,rusepin Tata Coffee Grand | Filte,,,,,,
WJTPX,WJTowell,B083VKRS1R,"Al Rifai Sunflower Seeds, 350g","Al Rifai Sunflower Seeds, 350g",,,,,,
WJTPX,WJTowell,B08C1CYV4B,Afia Pure Corn Oil 1.5Litre,Afia Pure Corn Oil 1.5Litre,,,,,,
WJTPX,WJTowell,B0095DQJ30,"Foster Clarks Creme CaRAMel, 71 gm","Foster Clarks Creme CaRAMel, 71 g",,,,,,
WJTPX,WJTowell,B004RFNPX8,No data available,No data available,,,,,,
WJTPX,WJTowell,B07NF8RTS4,Al Rifai Salted Pistachio - 180 gm,Al Rifai Salted Pistachio - 180 g,,,,,,
WJTPX,WJTowell,B08CHVBX48,CHINGS DESI CHINESE KA COMBO PACK 120g,CHINGS DESI CHINESE KA COMBO PACK,,,,,,
WJTPX,WJTowell,B07JL5CPNV,"foster clark's Raspberry Culinary Essence, 28 ml",foster clark's Raspberry Culinary,,,,,,
WJTPX,WJTowell,B081YZ6N84,"Ching's Secret Paneer Chilli Masala, 5 x 20 gm",Ching's Secret Paneer Chilli Masa,,,,,,
WJTPX,WJTowell,B0FLDCQ5VK,"Diamond Organic Raw Wild Flower Honey ñ 350g ñ Pure, Unfiltered & Natural Sweetener",Diamond Organic Raw Wild Flower H,,,,,,
WJTPX,WJTowell,B076ZW73YZ,Ching's Secret HOT & SOUR VEGETABLE SOUP 55g,Ching's Secret HOT & SOUR VEGETAB,,,,,,
WJTPX,WJTowell,B0BF72D275,Diamond White Honey Spoon -Easy to stir- Pure natural honey -Healthy sugar alternative,Diamond White Honey Spoon -Easy t,,,,,,
WJTPX,WJTowell,B09H6KZYJ9,CHINGS RED CHILLI SAUCE 200g,CHINGS RED CHILLI SAUCE 200g,,,,,,
WJTPX,WJTowell,B083VKM94Q,"Diamond Organic Honey Squeezer, 350 g","Diamond Organic Honey Squeezer, 3",,,,,,
WJTPX,WJTowell,B0CS375R72,DIAMOND ??????? Creamy Peanut butter 454g,DIAMOND ??????? Creamy Peanut but,,,,,,
WJTPX,WJTowell,B0DBR4V7W7,"Tata Salt Himalayan Rock Salt,With Natural Trace Minerals, 1kg Pouch","Tata Salt Himalayan Rock Salt,Wit",,,,,,
WJTPX,WJTowell,B083VKRS1M,"Al Rifai Barbecue Mixed Nuts, 160g","Al Rifai Barbecue Mixed Nuts, 160",,,,,,
WJTPX,WJTowell,B07PN2Q5H7,AL RIFAI DRY ROASTED PISTACHIOS 400g,AL RIFAI DRY ROASTED PISTACHIOS 4,,,,,,
WJTPX,WJTowell,B0C66476XR,Tata Sampann Meat Masala Rich Aroma & Flavour 100g,Tata Sampann Meat Masala Rich Aro,,,,,,
WJTPX,WJTowell,B087GL5MV7,"Diamond Black Forest Honey Jar, 500 gm","Diamond Black Forest Honey Jar, 5",,,,,,
WJTPX,WJTowell,B0C62C61N7,"Tata Coffee Gold, 100% Pure Coffee, Original, Freeze dried granules, Instant Coffee, Crafted from Specially Sourced Beans, 48g,Jar","Tata Coffee Gold, 100% Pure Coffe",,,,,,
