vendor_code,vendor_name,asin,item_name_raw,item_name_clean,brand,category,sub_category,pack_size,pack_unit,notes
SWM6A,Linkmax,B0B4QQHZ2K,Whittaker's 309 33% Cocoa Creamy Caramel Milk Chocolate 250 g,Whittaker's 309 33% Cocoa Creamy ,,,,,,
SWM6A,Linkmax,B0CD87PVQV,Rhythm 108 Hazelnut Chocolate Chip Biscuit Share Bag 135 g,Rhythm 108 Hazelnut Chocolate Chi,,,,,,
SWM6A,Linkmax,B00JDC1Y5G,"Zed Sour Blue Razz Flavour Jawbreaker Liquid Filled Tornado Pop, 997.5 Gm",Zed Sour Blue Razz Flavour Jawbre,,,,,,
SWM6A,Linkmax,B00IT8KMF8,Zpc Cream Fudge Luxury 775g,Zpc Cream Fudge Luxury 775g,,,,,,
SWM6A,Linkmax,B087GMFPZF,"Cagla Poky Twist Caramel Delight Chocolate, 1 Kg",Cagla Poky Twist Caramel Delight ,,,,,,
SWM6A,Linkmax,B0881MB9PB,"Swasco Choco Rocco Cream, 10 gm (Pack Of 72)","Swasco Choco Rocco Cream, 10 gm (",,,,,,
SWM6A,Linkmax,B00GKX89T0,Whittaker's 276 33% Cocoa Creamy Coconut Block Milk Chocolate 200 g,Whittaker's 276 33% Cocoa Creamy ,,,,,,
SWM6A,Linkmax,B07NF76KKP,Julie's Peanut Butter Sandwich 1.08 kg,Julie's Peanut Butter Sandwich 1.,,,,,,
SWM6A,Linkmax,B087GLTWHH,"Elvan Ti Amo Compound Chocolate, 450 gm","Elvan Ti Amo Compound Chocolate, ",,,,,,
SWM6A,Linkmax,B002RQTC0O,PONS ORGANIC EXTRA VIRGIN OLIVE OIL 500 ml,PONS ORGANIC EXTRA VIRGIN OLIVE O,,,,,,
SWM6A,Linkmax,B0DN1DSXSZ,Ragusa Classique Chocolate Bar With Hazelnut 100 Grams,Ragusa Classique Chocolate Bar Wi,,,,,,
SWM6A,Linkmax,B0C812QMR4,Orion Orice Seaweed Rice Cracker 12 packs,Orion Orice Seaweed Rice Cracker ,,,,,,
SWM6A,Linkmax,B087GNLVXH,"Americandy Big Bom XXL Mouth Painter Blue Lollipops, 25 Gm X 48 Pieces",Americandy Big Bom XXL Mouth Pain,,,,,,
SWM6A,Linkmax,B0941H3RLR,Rhythm 108 Hazelnut Chocolate Praline Soft-Baked Filled Cookie 50 g,Rhythm 108 Hazelnut Chocolate Pra,,,,,,
SWM6A,Linkmax,B087GJY5WY,"Palazi Lechao Hotdog Marshmallow Gummy Candy, 15 gm (Pack Of 24), large",Palazi Lechao Hotdog Marshmallow ,,,,,,
SWM6A,Linkmax,B00GX2PBBM,Whittaker's Creamy Milk chocolate Slabs 180g (pack of 12),Whittaker's Creamy Milk chocolate,,,,,,
SWM6A,Linkmax,B087GJT9VD,"Quanwang Swirl Mixed Fruit Lollipops, 50 Gm (Pack Of 24)",Quanwang Swirl Mixed Fruit Lollip,,,,,,
SWM6A,Linkmax,B00DIRED50,La Molisana Fussili Tricolor 500 Gms,La Molisana Fussili Tricolor 500 ,,,,,,
SWM6A,Linkmax,B000SSF10I,Bazooka Candy Brands Juicy Drop Strawberry / Blackcurrant Lollipop - 26 gms (Pack of 12),Bazooka Candy Brands Juicy Drop S,,,,,,
SWM6A,Linkmax,B0881MCV3Q,"Elvan My Honey Milky Compound Chocolate, 8 gm (Pack of 55)",Elvan My Honey Milky Compound Cho,,,,,,
SWM6A,Linkmax,B0CV7M385S,ZEEBA SUPER INDIAN BASMATI RICE 5KG,ZEEBA SUPER INDIAN BASMATI RICE 5,,,,,,
SWM6A,Linkmax,B0B57T66JL,PONS JANIROC KORONEIKI OLIVE OIL 500ml,PONS JANIROC KORONEIKI OLIVE OIL ,,,,,,
SWM6A,Linkmax,B0881MCV3N,"Colombina Bbb Jumbo Strawberry Flavour Bubble Gum Pops, 1.25 kg",Colombina Bbb Jumbo Strawberry Fl,,,,,,
SWM6A,Linkmax,B016IB9LKO,Whittaker's Mini Size Peanut Chocolate Slabs 180g (pack of 12),Whittaker's Mini Size Peanut Choc,,,,,,
SWM6A,Linkmax,B07QKZRHGZ,"Mir Assorted fruit jelly, 15 gm ,pack of 36","Mir Assorted fruit jelly, 15 gm ,",,,,,,
SWM6A,Linkmax,B0CV7RNLXS,ZEEBA CLASSIC INDIAN BASMATI RICE 1KG,ZEEBA CLASSIC INDIAN BASMATI RICE,,,,,,
SWM6A,Linkmax,B00SKTCUZQ,"Zed Strawberry Flavor Jawbreaker Liquid Filled Tornado Pop, 30 Count",Zed Strawberry Flavor Jawbreaker ,,,,,,
SWM6A,Linkmax,B008QTJUT4,Julie'S Love Letter Chocolate Wafer 100G,Julie'S Love Letter Chocolate Waf,,,,,,
SWM6A,Linkmax,B0DBHX5MBR,PONS JANIROC ARBEQUINA OLIVE OIL 500ml,PONS JANIROC ARBEQUINA OLIVE OIL ,,,,,,
SWM6A,Linkmax,B01LCX3D9S,Hectare's Julienne Lightly Sea Salt Sticks 70 g,Hectare's Julienne Lightly Sea Sa,,,,,,
SWM6A,Linkmax,B000TFN9U4,Bazooka Big Baby Sour Strawberry / Blackcurrant Lollipop - 32 gm (Pack Of 12),Bazooka Big Baby Sour Strawberry ,,,,,,
SWM6A,Linkmax,B0BMXT2612,Deemah Marmo Cake Chocolate 40 grams (Pack of 12),Deemah Marmo Cake Chocolate 40 gr,,,,,,
SWM6A,Linkmax,B082HHBYD6,Julie's Cheese Sandwch 168G,Julie's Cheese Sandwch 168G,,,,,,
SWM6A,Linkmax,B0881N34S8,"Elvan Coffex Coffee Candy, 300 gm","Elvan Coffex Coffee Candy, 300 gm",,,,,,
SWM6A,Linkmax,B07WH3H252,Lago Mini Party SUGAR FREE Wafers with Hazelnut Cream - 125 gms,Lago Mini Party SUGAR FREE Wafers,,,,,,
SWM6A,Linkmax,B0BN5F5TBW,Bazooka Mix Upz Sweet Candy 120 g,Bazooka Mix Upz Sweet Candy 120 g,,,,,,
SWM6A,Linkmax,B0912ZZ5M9,BN United Biscuits Strawberry Sandwich Cookies 285g,BN United Biscuits Strawberry San,,,,,,
SWM6A,Linkmax,B097CZ3SMH,DEEMAH Double Chocolate Muffin 25Gr (Pack Of 16),DEEMAH Double Chocolate Muffin 25,,,,,,
SWM6A,Linkmax,B087GN5BKB,"Tian'S Barbecue Marshmallow, 225 Gm","Tian'S Barbecue Marshmallow, 225 ",,,,,,
SWM6A,Linkmax,B0CB7T9KRB,Bisconni Cocomo Chocolate Filled Biscuits 400g,Bisconni Cocomo Chocolate Filled ,,,,,,
SWM6A,Linkmax,B01L774SYS,Hectare's Lightly Sea Salted Popcorn 20 g,Hectare's Lightly Sea Salted Popc,,,,,,
SWM6A,Linkmax,B0DN1DPSKK,Ragusa Noir Dark Chocolate Bar 100 Gram (60% of Dark Cocoa),Ragusa Noir Dark Chocolate Bar 10,,,,,,
SWM6A,Linkmax,B07NF59N4D,NAMAKIN FINE CUCUMBER PICKLE -700 GM,NAMAKIN FINE CUCUMBER PICKLE -700,,,,,,
SWM6A,Linkmax,B087GMHY5V,"Elvan Lady Bird Milky Compound Chocolate, 8 gm X 55 Pieces",Elvan Lady Bird Milky Compound Ch,,,,,,
SWM6A,Linkmax,B087GK5KQY,"Guylian The Original Belgian Chocolates With Hazelnut Praline Filling Sea Shells, 33 Gm (Pack Of 24)",Guylian The Original Belgian Choc,,,,,,
SWM6A,Linkmax,B09BN468H3,Palazi Tamarind Paste With Chili Natural,Palazi Tamarind Paste With Chili ,,,,,,
SWM6A,Linkmax,B097D1448R,DEEMAH Cupcake Chocolate Cream (Pack Of 16),DEEMAH Cupcake Chocolate Cream (P,,,,,,
SWM6A,Linkmax,B07C411HJ1,"Elvan Dr Milk CaRAMel Filled Hard Candy, 1 Kg",Elvan Dr Milk CaRAMel Filled Hard,,,,,,
SWM6A,Linkmax,B087GM3TH1,"Americandy Big Bom XXL Ta-Ta-Ma Cheery Lollipops, 25 gm",Americandy Big Bom XXL Ta-Ta-Ma C,,,,,,
SWM6A,Linkmax,B087GJ9617,"Swasco Seno Choco Cream, 14 Gm (Pack Of 72), large","Swasco Seno Choco Cream, 14 Gm (P",,,,,,
SWM6A,Linkmax,B0767DQL11,"Erko Mr. Bbq Pink-White Marshmallow, 250 gm",Erko Mr. Bbq Pink-White Marshmall,,,,,,
SWM6A,Linkmax,B01L774J5G,"Hectare's Popcorn Butter, 20 g","Hectare's Popcorn Butter, 20 g",,,,,,
SWM6A,Linkmax,B0CV7FQR8K,ZEEBA CREAMY SELLA INDIAN BASMATI RICE 5KG,ZEEBA CREAMY SELLA INDIAN BASMATI,,,,,,
SWM6A,Linkmax,B087GKJ2LT,"Orion Custard Soft Cake, 23 Gm (Pack Of 12)","Orion Custard Soft Cake, 23 Gm (P",,,,,,
SWM6A,Linkmax,B076FK2TJV,The Jelly Bean Factory Pop A - 100 gm,The Jelly Bean Factory Pop A - 10,,,,,,
SWM6A,Linkmax,B087C6WK5P,"Little Freddie Organic Vibrant Peaches & Raspberries, 100g, 6+ months",Little Freddie Organic Vibrant Pe,,,,,,
SWM6A,Linkmax,B087GKK8YY,"Quanwang Spiral Mixed Fruit Lollipops, 50 gm (Pack Of 24)",Quanwang Spiral Mixed Fruit Lolli,,,,,,
SWM6A,Linkmax,B08M7F4GB2,Little Freddie Organic Banana Biscuits - 12+ Months Baby Food & Snacks,Little Freddie Organic Banana Bis,,,,,,
SWM6A,Linkmax,B087GM93B1,"Nom Noms Original Mini Marshmallow, 12 X 22 gm",Nom Noms Original Mini Marshmallo,,,,,,
SWM6A,Linkmax,B00W3LXB4G,"Julie's Oats 25, Hazel Nut's and Chocolate Chips, 200g","Julie's Oats 25, Hazel Nut's and ",,,,,,
SWM6A,Linkmax,B00Q8VI8GI,"Elvan Ti Amo Milky Compound Chocolate, 450 gm",Elvan Ti Amo Milky Compound Choco,,,,,,
SWM6A,Linkmax,B087C5XV8Y,"Little Freddie Organic Luscious Cherry Greek Style Yoghurt, 100g, 6+ months",Little Freddie Organic Luscious C,,,,,,
SWM6A,Linkmax,B0B3S4KRWW,Rhythm 108 Swiss Roasted Almond Butter - 100g,Rhythm 108 Swiss Roasted Almond B,,,,,,
SWM6A,Linkmax,B0881MCM6J,"Zpc MilanÛwek Milky Cream Fudge, 2 Kg","Zpc MilanÛwek Milky Cream Fudge, ",,,,,,
SWM6A,Linkmax,B087GKD2RP,"Lechao Palazi Love Marshmallow Fruit Candy, 15 Gm (Pack Of 24)",Lechao Palazi Love Marshmallow Fr,,,,,,
SWM6A,Linkmax,B087GLYW59,"Fuego Trikos Taqui Rolitos Hot Chilli Pepper And Lime Tortilla Chips, 28Gm",Fuego Trikos Taqui Rolitos Hot Ch,,,,,,
SWM6A,Linkmax,B087GJFD6Q,"Stone Chocolate , 190 Gm","Stone Chocolate , 190 Gm",,,,,,
SWM6A,Linkmax,B09QJ3DZPR,Rhythm 108 Swiss Milk & Hazelnut Truffle Chocolate - 100g,Rhythm 108 Swiss Milk & Hazelnut ,,,,,,
SWM6A,Linkmax,B00QH75VA4,"Erko mallow world pink-white marshmallow, 150 gm, large",Erko mallow world pink-white mars,,,,,,
SWM6A,Linkmax,B00EC9IIY0,Guylian Tablets Creamy Milk Chocolate Bar 100 g,Guylian Tablets Creamy Milk Choco,,,,,,
SWM6A,Linkmax,B0BDGHGZCV,Namakin Cucumber Pickle 700g,Namakin Cucumber Pickle 700g,,,,,,
SWM6A,Linkmax,B077P3MHY2,Guylian The Original Seashells Belgian Chocolates with Hazelnut Praline Filling 65 g,Guylian The Original Seashells Be,,,,,,
SWM6A,Linkmax,B087GKYZDQ,"Jewel Ring Bokyong Melon Flavor Candy, 13.5 (Pack Of 24)",Jewel Ring Bokyong Melon Flavor C,,,,,,
SWM6A,Linkmax,B09WHVMND3,La Molisana Arrabbiata Sauce 340g,La Molisana Arrabbiata Sauce 340g,,,,,,
SWM6A,Linkmax,B097CXWYKL,Deemah Cup Cake Vanilla Cream (Pack Of 16),Deemah Cup Cake Vanilla Cream (Pa,,,,,,
SWM6A,Linkmax,B087GMR5PG,"Americandy Big Bom XXL Strawberry Lollipops, 25 gm",Americandy Big Bom XXL Strawberry,,,,,,
SWM6A,Linkmax,B07NHP1BMD,La Molisana Penne Rigt Organc N20,La Molisana Penne Rigt Organc N20,,,,,,
SWM6A,Linkmax,B0969XWR2J,Push Pop Bazooka Mega 30g (Pack Of 18),Push Pop Bazooka Mega 30g (Pack O,,,,,,
SWM6A,Linkmax,B09NKTVZVL,BN United Biscuits Chocolate Sandwich Cookies Sandwich Cookies 285g,BN United Biscuits Chocolate Sand,,,,,,
SWM6A,Linkmax,B087GMBZDM,"Palazi Assorted Chocolate Turffle, 1 Kg",Palazi Assorted Chocolate Turffle,,,,,,
SWM6A,Linkmax,B087GKB9ZK,"Rico Mini Cheese Ring, 10 gm (Pack of 30)","Rico Mini Cheese Ring, 10 gm (Pac",,,,,,
SWM6A,Linkmax,B087GM4WV7,"Elvan jelaxy funny animals gummy candy, 480 gm",Elvan jelaxy funny animals gummy ,,,,,,
SWM6A,Linkmax,B087GM4WR7,"Felfoldi Strawberry Flavour Magic Sipper, 30 X 36 gm, large",Felfoldi Strawberry Flavour Magic,,,,,,
SWM6A,Linkmax,B0847QHPHD,Bazooka Candy Brands Juicy Drop Blasts 120g,Bazooka Candy Brands Juicy Drop B,,,,,,
SWM6A,Linkmax,B087GLG43H,"Geeef Magic Pop Orange Flavor Popping Candy, 5.5 Gm (Pack Of 40)",Geeef Magic Pop Orange Flavor Pop,,,,,,
SWM6A,Linkmax,B087GMQ5Q9,"Swasco Bahloul Biscuit & Chocolate Cream, 24 X 25 Gm",Swasco Bahloul Biscuit & Chocolat,,,,,,
SWM6A,Linkmax,B01LCWZEAU,Hectare's Sweet Chilli Veggisaurs Sticks 30 g,Hectare's Sweet Chilli Veggisaurs,,,,,,
SWM6A,Linkmax,B07ZLRCDFT,YR Midwakh Silver Platinum/????? ?????,YR Midwakh Silver Platinum/????? ,,,,,,
SWM6A,Linkmax,B087GJVRVS,"Americandy Big Bom XL Mouth Painter Double Bubble Gum Lollipop, 16 gm (Pack Of 48)",Americandy Big Bom XL Mouth Paint,,,,,,
SWM6A,Linkmax,B00L2YF49U,La Molisana Spaghetti Al Nero Di Seppia,La Molisana Spaghetti Al Nero Di ,,,,,,
SWM6A,Linkmax,B087GKXXFG,Nom Noms Marsh Mallows Original Candy 150g,Nom Noms Marsh Mallows Original C,,,,,,
SWM6A,Linkmax,B0881MF429,"Eti Wafe'Up Extra Cocoa Cream With Peanut Pieces Wafer, 29 gm (Pack Of 24)",Eti Wafe'Up Extra Cocoa Cream Wit,,,,,,
SWM6A,Linkmax,B087C89BGH,Little Freddie Organic Creamy Banana Greek Style Yoghurt (100g) - 6+ Months Baby Food & Snacks,Little Freddie Organic Creamy Ban,,,,,,
SWM6A,Linkmax,B076KP39PC,Bazooka Push Pop Raspberry / Cola Lollipop - 15 gm (Pack of 20),Bazooka Push Pop Raspberry / Cola,,,,,,
SWM6A,Linkmax,B07NF5YH6Z,"Palazi Luxury Cream Fudge, 450 gm","Palazi Luxury Cream Fudge, 450 gm",,,,,,
SWM6A,Linkmax,B092WC3MTS,Juicy Drop Bazooka Blast Sour Chewy Candies - 120 gms (Pack Of 12),Juicy Drop Bazooka Blast Sour Che,,,,,,
SWM6A,Linkmax,B07NHNK7KJ,La Molisana Speghetti Organic N15,La Molisana Speghetti Organic N15,,,,,,
SWM6A,Linkmax,B07NF773RN,NAMAKIN BABY CUCUMBER PICKLE - 700 GM,NAMAKIN BABY CUCUMBER PICKLE - 70,,,,,,
SWM6A,Linkmax,B00I2F442K,"Asturi Bruschettini Garlic And Parsley Toasts, 120 gm",Asturi Bruschettini Garlic And Pa,,,,,,
SWM6A,Linkmax,B087GL6V4M,"Lechao Burger Marshmallow Gummy Candy, 15 gm (Pack Of 24)",Lechao Burger Marshmallow Gummy C,,,,,,
SWM6A,Linkmax,B087GMVKR5,"Erko Mallow Ice-Cream Flavour Cone Marshmallow, 100 Gm",Erko Mallow Ice-Cream Flavour Con,,,,,,
SWM6A,Linkmax,B0CTHNT8ZV,ORION ORICE CHEESE POTATO 12 Packs,ORION ORICE CHEESE POTATO 12 Pack,,,,,,
SWM6A,Linkmax,B087GL6V29,"Nom Noms Mixed Fruit Marsh Mallows, 300 gm, large",Nom Noms Mixed Fruit Marsh Mallow,,,,,,
SWM6A,Linkmax,B0CB89F24R,Candyland Burger Jelly 14g (pack of 24),Candyland Burger Jelly 14g (pack ,,,,,,
SWM6A,Linkmax,B0CJLQR2WX,Ulker Biskrem Cocoa Cream Filled Cookies 36 gms (pack of 12),Ulker Biskrem Cocoa Cream Filled ,,,,,,
SWM6A,Linkmax,B00325L5WM,"Orion Choco-Pie, 360 g","Orion Choco-Pie, 360 g",,,,,,
SWM6A,Linkmax,B07NF7V8JF,Larbee Book Cat Mini Fruit Jelly 500g,Larbee Book Cat Mini Fruit Jelly ,,,,,,
SWM6A,Linkmax,B0881M8KCG,"Palazi Mini Fruit Flavoured Jelly, 1.6 Kg",Palazi Mini Fruit Flavoured Jelly,,,,,,
SWM6A,Linkmax,B087GL3GHQ,Bazooka Candy Brands Triple Power Push Pop Red Lollipop - 34 gm (Pack of 12),Bazooka Candy Brands Triple Power,,,,,,
SWM6A,Linkmax,B087C6RSY9,Little Freddie Organic Balanced Prunes & Apples Puree (100g) - 6+ Months Baby Food & Snacks,Little Freddie Organic Balanced P,,,,,,
SWM6A,Linkmax,B075VQMLVN,"Erko Twists Mallow 500g, large","Erko Twists Mallow 500g, large",,,,,,
SWM6A,Linkmax,B07Q87PN5G,"Colombina Bon Bon Bum Jumbo Strawberry Flavour Bubble Gum Pops, 816 Gm",Colombina Bon Bon Bum Jumbo Straw,,,,,,
SWM6A,Linkmax,B087GKLJMZ,"Quanwang Watermelon Flavour Lollipops, 50 Gm (Pack Of 24)",Quanwang Watermelon Flavour Lolli,,,,,,
SWM6A,Linkmax,B087GMDHZY,"Erko Hearts Marshmallow World, 120 Gm","Erko Hearts Marshmallow World, 12",,,,,,
SWM6A,Linkmax,B001YZEKNI,Julie'S Love Letter Strawberry Wafer 100G,Julie'S Love Letter Strawberry Wa,,,,,,
SWM6A,Linkmax,B07NCJ2179,Bazooka Juicy Drop Raspberry / /Cola Lollipop - 26 gms (Pack Of 12),Bazooka Juicy Drop Raspberry / /C,,,,,,
SWM6A,Linkmax,B087GMJZTC,"Palazi Luxury Cream Fudge, 2 Kg","Palazi Luxury Cream Fudge, 2 Kg",,,,,,
SWM6A,Linkmax,B005MM9ZMU,"K¸hne American Caesar Salad Dressing, 250 ml",K¸hne American Caesar Salad Dress,,,,,,
SWM6A,Linkmax,B006J3HS98,JULIE'S Oat 25 Strawberry 200G,JULIE'S Oat 25 Strawberry 200G,,,,,,
SWM6A,Linkmax,B077SBKPPY,"K¸hne Made For Meat Hot Chili Sriracha Sauce, 235 Ml",K¸hne Made For Meat Hot Chili Sri,,,,,,
SWM6A,Linkmax,B0064OHZYK,"Lutti Roll Up Tutti Fruity Bubble Gum, 29 gm (Pack Of 24)",Lutti Roll Up Tutti Fruity Bubble,,,,,,
SWM6A,Linkmax,B087GJKXV6,"Orion Choco Pie, 360 gm","Orion Choco Pie, 360 gm",,,,,,
SWM6A,Linkmax,B003LAC1LW,"Lutti Cherry Tubble Bubble Gum, 35 Gm (Pack Of 36)","Lutti Cherry Tubble Bubble Gum, 3",,,,,,
SWM6A,Linkmax,B087GMJGY2,"Tian'S Mallow Circle Marshmallow, 327 Gm","Tian'S Mallow Circle Marshmallow,",,,,,,
SWM6A,Linkmax,B07DC7ZTM2,"Bazooka Triple Power Push Pop 3 In 1 Flavours - 34g, 12 Pieces",Bazooka Triple Power Push Pop 3 I,,,,,,
SWM6A,Linkmax,B087GMG88N,"Americandy Big Bom XXL Sandia Watermelon Lollipops, 25 Gm",Americandy Big Bom XXL Sandia Wat,,,,,,
SWM6A,Linkmax,B09N7F8S7G,The Jelly Bean Factory 36 Huge Flavors Jelly Beans Multicolor,The Jelly Bean Factory 36 Huge Fl,,,,,,
SWM6A,Linkmax,B00MRINI66,"Orion Choco Pie, 30 Gm (Pack Of 6)","Orion Choco Pie, 30 Gm (Pack Of 6",,,,,,
SWM6A,Linkmax,B00I2F43VW,"Asturi Bruschettini Classico Virgin Olive Oil Toasts, 120 Gm",Asturi Bruschettini Classico Virg,,,,,,
SWM6A,Linkmax,B087GMRW36,"Americandy Big Bom XXL Black Lollipops, 25 gm",Americandy Big Bom XXL Black Loll,,,,,,
SWM6A,Linkmax,B087GN5BKJ,"Majami Krowki Luxury Cream Fudge, 400 Gm","Majami Krowki Luxury Cream Fudge,",,,,,,
SWM6A,Linkmax,B09BN4JB9G,Palazi Tamarind Paste Caramel,Palazi Tamarind Paste Caramel,,,,,,
SWM6A,Linkmax,B0036E8CK2,Zed Mini Gum Balls Machine 35g,Zed Mini Gum Balls Machine 35g,,,,,,
SWM6A,Linkmax,B0BMXRXYY1,Deemah Donut Cake Chocolate 40 grams (Pack of 12),Deemah Donut Cake Chocolate 40 gr,,,,,,
SWM6A,Linkmax,B07WG3FCP1,Lago Mini Party SUGAR FREE Wafers with Cocoa Cream - 125 gms,Lago Mini Party SUGAR FREE Wafers,,,,,,
SWM6A,Linkmax,B08PFV8MRC,Whittaker's Tweats Mini Slabs Chocolate(pack of 12),Whittaker's Tweats Mini Slabs Cho,,,,,,
SWM6A,Linkmax,B0DN1FHXCV,Ragusa Blond Caramilise Chocolate Bar 100 Gram,Ragusa Blond Caramilise Chocolate,,,,,,
SWM6A,Linkmax,B09HXPTK1G,PONS PURE CLASSIC OLIVE OIL 500 ml,PONS PURE CLASSIC OLIVE OIL 500 m,,,,,,
SWM6A,Linkmax,B087GLW295,"Nom Noms Strawberry Flavour Mini Marshmallow, 12 X 22 gm",Nom Noms Strawberry Flavour Mini ,,,,,,
SWM6A,Linkmax,B086BL3P2V,Bazooka Candy Brands Rattlerz Fruity Chewy - 40 gms (pack of 24),Bazooka Candy Brands Rattlerz Fru,,,,,,
SWM6A,Linkmax,B087GKBJL1,"Rico Mango Flavor Pudding, 40 Gm (Pack Of 24)","Rico Mango Flavor Pudding, 40 Gm ",,,,,,
SWM6A,Linkmax,B0064OI6WK,"Zed Explosively Sour Gum Powder, 35 Gm (Pack Of 30)","Zed Explosively Sour Gum Powder, ",,,,,,
SWM6A,Linkmax,B0FDPVXF2K,Little Freddie Organic Carrot Puffs - 6+ Months Baby Food & Snacks,Little Freddie Organic Carrot Puf,,,,,,
SWM6A,Linkmax,B087GKS2K8,"Erko Ice Cream Marshmallow Plus, 250 gm","Erko Ice Cream Marshmallow Plus, ",,,,,,
SWM6A,Linkmax,B0DBHSHX6Q,PONS ORGANICO OLIVE OIL 500ml,PONS ORGANICO OLIVE OIL 500ml,,,,,,
SWM6A,Linkmax,B07JWGJQNZ,"Erko Bear Shape Marshmallow, 200 Gm","Erko Bear Shape Marshmallow, 200 ",,,,,,
SWM6A,Linkmax,B0881MBB6L,"Palazi Oat Chocolate Choco, 200 gm","Palazi Oat Chocolate Choco, 200 g",,,,,,
SWM6A,Linkmax,B09WRKKXWG,Lago Poker Sugar Free Wafers with Cocoa Cream - 45 gms (Pack of 4),Lago Poker Sugar Free Wafers with,,,,,,
SWM6A,Linkmax,B0B59LGN9W,La Molisana Bolognese Sauce 340g,La Molisana Bolognese Sauce 340g,,,,,,
SWM6A,Linkmax,B07NF7TSB6,"Arcor Dulce De Leche And Caramel Butter Toffees, 500 Gm",Arcor Dulce De Leche And Caramel ,,,,,,
SWM6A,Linkmax,B0881MNQDX,"Eti Wafe'Up Extra Hazelnut Cream With Peanut Pieces Wafer, 29 Gm (Pack Of 24)",Eti Wafe'Up Extra Hazelnut Cream ,,,,,,
SWM6A,Linkmax,B087GMJZVQ,"Americandy Big Bom XXL White Lollipops, 25 gm",Americandy Big Bom XXL White Loll,,,,,,
SWM6A,Linkmax,B08VW7NWDX,Glebe Farms ORGANIC GLUTEN FREE PORRIDGE OATS - 450g,Glebe Farms ORGANIC GLUTEN FREE P,,,,,,
SWM6A,Linkmax,B087GJ6854,"Lechao Delicious Marshmallow Candy, 15 gm (Pack of 24), large",Lechao Delicious Marshmallow Cand,,,,,,
SWM6A,Linkmax,B0969ZM844,Juicy Drop Bazooka Blast Sour Chewy Candies - 45 gms (Pack Of 24),Juicy Drop Bazooka Blast Sour Che,,,,,,
SWM6A,Linkmax,B017DO6ET6,Guylian Opus Luxury Assorted Belgian Chocolates 180 g,Guylian Opus Luxury Assorted Belg,,,,,,
SWM6A,Linkmax,B0B57RZNB8,PONS JANIROC OLIVE OIL 5TH GENERATION 500ml,PONS JANIROC OLIVE OIL 5TH GENERA,,,,,,
SWM6A,Linkmax,B087GKXXHH,"Lechao Flower Marshmallow Candy, 15 Gm (Pack Of 24), large","Lechao Flower Marshmallow Candy, ",,,,,,
SWM6A,Linkmax,B07K459Y34,Ulker Petit Beurre Biscuits 1 kg,Ulker Petit Beurre Biscuits 1 kg,,,,,,
SWM6A,Linkmax,B00TX9952I,MCVITIE'S BOURBON CREAM 100 GRAMS,MCVITIE'S BOURBON CREAM 100 GRAMS,,,,,,
SWM6A,Linkmax,B0102KWK14,Tabasco Pons. Extra Virgin Olive Oil infused with Seasoning. 250ml (8.45oz),Tabasco Pons. Extra Virgin Olive ,,,,,,
SWM6A,Linkmax,B0BMXV1H6S,Deemah Browni Cake Chocolate 37 grams (Pack of 12),Deemah Browni Cake Chocolate 37 g,,,,,,
SWM6A,Linkmax,B087GKJ2LC,"Cloetta Red Band Tutti Frutti Bears Candy, 18 gm (Pack Of 30)",Cloetta Red Band Tutti Frutti Bea,,,,,,
SWM6A,Linkmax,B09FHV2D23,Lago Mini Wafer Roll with Cocoa Cream - 125 gms,Lago Mini Wafer Roll with Cocoa C,,,,,,
SWM6A,Linkmax,B087GL49DP,"Elvan My Car Milky Compound Chocolate, 8 Gm",Elvan My Car Milky Compound Choco,,,,,,
SWM6A,Linkmax,B087GM9S1R,"Elvan Jelaxy Merry Berries Gummy Candy, 20 gm",Elvan Jelaxy Merry Berries Gummy ,,,,,,
SWM6A,Linkmax,B0CB84KJKW,Candyland Pizza Jelly Tutty Fruity Pack (21g X 12),Candyland Pizza Jelly Tutty Fruit,,,,,,
SWM6A,Linkmax,B086BT1F38,"Bazooka Rattlerz Sour Chewy Candies, 24 x 40 gm",Bazooka Rattlerz Sour Chewy Candi,,,,,,
SWM6A,Linkmax,B0987R58WT,Lago Mini Wafer Roll with Cocoa Cream - 125 gms,Lago Mini Wafer Roll with Cocoa C,,,,,,
SWM6A,Linkmax,B0C9DNQMZ2,"Little Freddie Organic Haricot Bean Sweet Potato Cassoulet, 130g, 7+ months",Little Freddie Organic Haricot Be,,,,,,
SWM6A,Linkmax,B07KRDNTB6,"Cici flash bag hazelnut chocolate, 500g",Cici flash bag hazelnut chocolate,,,,,,
SWM6A,Linkmax,B01L774HWQ,Hectare's HECTARES POTATO CHIPS SEA SALT 40G,Hectare's HECTARES POTATO CHIPS S,,,,,,
SWM6A,Linkmax,B01LCWY6X6,Hectare's VEGGISAURS SEA SALT 30G,Hectare's VEGGISAURS SEA SALT 30G,,,,,,
SWM6A,Linkmax,B087GJT9TC,"Zed Centre Sour Cherry, Mojito, Passion Flavor Liquid Filled Tornado Pop Bubble Gum, 33.5 gm (Pack Of 35)","Zed Centre Sour Cherry, Mojito, P",,,,,,
SWM6A,Linkmax,B0D6G2P9YY,BN United Biscuits Chocolate Pocket Sandwich Cookies (pack of 4) 150g,BN United Biscuits Chocolate Pock,,,,,,
SWM6A,Linkmax,B0BMXTLJQP,Deemah Fantasy Cake Chocolate 40 grams (Pack of 12),Deemah Fantasy Cake Chocolate 40 ,,,,,,
SWM6A,Linkmax,B0D6748NQG,BN United Biscuits Vanilla Sandwich Cookies 285g,BN United Biscuits Vanilla Sandwi,,,,,,
SWM6A,Linkmax,B087GM9393,"Tian'S Mallow Ice Cream Strawberry Marshmallow, 100 gm",Tian'S Mallow Ice Cream Strawberr,,,,,,
SWM6A,Linkmax,B087GJKXSY,"Tian'S Confection Mallow Pink And White Marshmallow Candy, 225 gm",Tian'S Confection Mallow Pink And,,,,,,
SWM6A,Linkmax,B087GMBYRZ,"Americandy Big Bom XXL Fusion Lollipops, 25 gm",Americandy Big Bom XXL Fusion Lol,,,,,,
SWM6A,Linkmax,B087GL7DG7,"Orion Double Choco Pie, 30 gm (Pack Of 12)","Orion Double Choco Pie, 30 gm (Pa",,,,,,
SWM6A,Linkmax,B0881MH8D7,"Elvan Truffle Caramel Milky Compound Chocolate, 2 Kg",Elvan Truffle Caramel Milky Compo,,,,,,
SWM6A,Linkmax,B087GJFQ8L,"Nom Nom Nom Noms Marsh Mallows Strawberry Candy 150g, large",Nom Nom Nom Noms Marsh Mallows St,,,,,,
SWM6A,Linkmax,B087GJMBTX,"Mir Angry Bird Fruit Jelly Jar, 15 Gm (Pack Of 30)","Mir Angry Bird Fruit Jelly Jar, 1",,,,,,
SWM6A,Linkmax,B007M88L1I,Lago Poker Nocciola Hazelnut Cream - 5 X 45 Gm,Lago Poker Nocciola Hazelnut Crea,,,,,,
SWM6A,Linkmax,B0B59HGL6Q,La Molisana Al Basilico Sauce 340g,La Molisana Al Basilico Sauce 340,,,,,,
SWM6A,Linkmax,B087GLRBKR,"Americandy Big Bom XXL Berries, 25 Gm","Americandy Big Bom XXL Berries, 2",,,,,,
SWM6A,Linkmax,B087GK2ST5,"Zed Watermelon Flavor Gumball, 35 Gm (Pack Of 40)","Zed Watermelon Flavor Gumball, 35",,,,,,
SWM6A,Linkmax,B0D6G4GS5W,BN United Biscuits Strawberry Pocket Sandwich (pack of 4) Cookies 150g,BN United Biscuits Strawberry Poc,,,,,,
SWM6A,Linkmax,B000WFK5WQ,Bazooka Candy Brands MEGA MOUTH 23 gm,Bazooka Candy Brands MEGA MOUTH 2,,,,,,
SWM6A,Linkmax,B0DBHS211L,PONS TRADITIONAL OLIVE OIL 500 ml,PONS TRADITIONAL OLIVE OIL 500 ml,,,,,,
SWM6A,Linkmax,B083B1KZYS,"Solen Amada Next Chocolove, 117 gm","Solen Amada Next Chocolove, 117 g",,,,,,
SWM6A,Linkmax,B087GLHXCZ,"Nom Noms Chocolate Marsh Mallows, 150 Gm","Nom Noms Chocolate Marsh Mallows,",,,,,,
SWM6A,Linkmax,B0968QTK5F,"Solen Jacky Cocoa Wafer, 24 X 20 Gm","Solen Jacky Cocoa Wafer, 24 X 20 ",,,,,,
SWM6A,Linkmax,B087GJT9W8,"Orion Double Choco Pie, 30 Gm (Pack Of 6)","Orion Double Choco Pie, 30 Gm (Pa",,,,,,
SWM6A,Linkmax,B07NF6BKJW,Bazooka Flip N Dip Push Pop chocolate - 200 gm,Bazooka Flip N Dip Push Pop choco,,,,,,
SWM6A,Linkmax,B0FDLCHG1J,Little Freddie Organic Original Baby Rice - 6+ Months Baby Food & Snacks,Little Freddie Organic Original B,,,,,,
SWM6A,Linkmax,B003XEFYGK,Chewits Xtreme Sour Apple Sweets 34 g (24pcs),Chewits Xtreme Sour Apple Sweets ,,,,,,
SWM6A,Linkmax,B087GR8LGM,"Elvan Cocos Coconut Milky Compound Chocolate Bar, 24 Gm, Pack Of",Elvan Cocos Coconut Milky Compoun,,,,,,
SWM6A,Linkmax,B087GL6V26,"Swasco Choco Rocco Heart Cream, 15 gm (Pack Of 48)","Swasco Choco Rocco Heart Cream, 1",,,,,,
SWM6A,Linkmax,B087GKVNXH,"Cloetta Red Band Tutti Frutti Cola Mix Candy, 18 gm (Pack of 30)",Cloetta Red Band Tutti Frutti Col,,,,,,
SWM6A,Linkmax,B01L774H26,Hectare's Sea Salt and Balsamic Vinegar Hand Cooked Potato Chips 40 g,Hectare's Sea Salt and Balsamic V,,,,,,
SWM6A,Linkmax,B087GMFPZZ,"Nom Noms Sours Peach Flavour Mini Marshmallow, 12 x 22 gm",Nom Noms Sours Peach Flavour Mini,,,,,,
SWM6A,Linkmax,B007INMGVS,Lago Sfogliatine Zuccherate - Sugared Puff Pastry Biscuits - 135 gms,Lago Sfogliatine Zuccherate - Sug,,,,,,
SWM6A,Linkmax,B00OCC6X94,HELLEMA PEANUT COOKIES 175G,HELLEMA PEANUT COOKIES 175G,,,,,,
SWM6A,Linkmax,B0CV7D3D61,ZEEBA PREMIUM INDIAN BASMATI RICE 1KG,ZEEBA PREMIUM INDIAN BASMATI RICE,,,,,,
SWM6A,Linkmax,B087GMZG2V,"Saadet Shock 2 Shock Sour Cherry Flavour Chewing Gum, 100 X 4 gm",Saadet Shock 2 Shock Sour Cherry ,,,,,,
SWM6A,Linkmax,B00M84TIDQ,"Arcor Assorted Flavours Butter Toffees, 300 gm",Arcor Assorted Flavours Butter To,,,,,,
SWM6A,Linkmax,B00853036U,HELLEMA CHOCOLATE PEANUT COOKIES 150G,HELLEMA CHOCOLATE PEANUT COOKIES ,,,,,,
SWM6A,Linkmax,B0B57SHLKM,PONS JANIROC LECCIANA OLIVE OIL 500ml,PONS JANIROC LECCIANA OLIVE OIL 5,,,,,,
SWM6A,Linkmax,B087GKFJ9R,Bazooka Candy Brands Rattlerz Sour Chewy - 120 gms (pack of 12),Bazooka Candy Brands Rattlerz Sou,,,,,,
SWM6A,Linkmax,B0051C0GK6,Chewits Cloetta Chewits Strawberry Flavour Candy 30 g (24pcs),Chewits Cloetta Chewits Strawberr,,,,,,
SWM6A,Linkmax,B0D673QKGT,BN United Biscuits Vanilla Pocket Sandwich Cookies (pack of 4) 150g,BN United Biscuits Vanilla Pocket,,,,,,
SWM6A,Linkmax,B087GKX9FC,"The Great Canadian Tea Company Ltd. Canel'S Sour Cherry Flavor Candy, 1.5 kg",The Great Canadian Tea Company Lt,,,,,,
SWM6A,Linkmax,B086X2HD1Q,Ulker Chocosandwich Cream Biscuits 23.5 gms (pack of 24),Ulker Chocosandwich Cream Biscuit,,,,,,
SWM6A,Linkmax,B09NKXCGT1,BN United Biscuits Chocolate Hazelnut Sandwich Cookies 285g,BN United Biscuits Chocolate Haze,,,,,,
SWM6A,Linkmax,B077SBY51Q,"K¸hne Made For Meat Black Garlic And Pepper Sauce, 235 Ml",K¸hne Made For Meat Black Garlic ,,,,,,
SWM6A,Linkmax,B087GJH1JV,"Mir Assorted Fruit Jelly Jar, 15 gm (Pack Of 80)","Mir Assorted Fruit Jelly Jar, 15 ",,,,,,
SWM6A,Linkmax,B0DMZWKW7W,Dr. CHOQ Caramel Sea Salted Chocolate Bar 150 Grams,Dr. CHOQ Caramel Sea Salted Choco,,,,,,
SWM6A,Linkmax,B087GKYZB5,"Carne Diem Smoked Original Halal Stick Beef, 25 Gm (Pack Of 20)",Carne Diem Smoked Original Halal ,,,,,,
